,title,brand,price,description,colour,category
784,Pieces knitted flared trousers co-ord,PIECES,53.97, Part of a co-ord set  Jumper sold separately      Ribbed finish  High rise        Stretch waistband   Flared shape  Cut with a straight leg that flares at the knee ,missing,bottoms
785,adidas Originals Locked Up track pants in lilac,adidas,80.96,"      Your casual vibe, sorted    Stretch waistband        Side pockets    adidas 3-Stripe logo    Stretch cuffs       Regular fit  Just select your usual size ",missing,bottoms
786,ASOS DESIGN tracksuit zip through hoody / basic jogger in fleece,adidas,64.77,"     Style and comfort – it's a lifestyle  Tracksuit set  Drawstring hoodie  Zip fastening  Drop shoulders  Ribbed trims  Matching drawstring joggers  Side pockets  Sweatshirt is an oversized fit  Joggers are a regular, tapered fit ",missing,bottoms
787,ASOS DESIGN oversized neon jogger,ASOS DESIGN,39.58,     They've already got your attention      Stretch waistband       Side pockets      Fitted cuffs  Oversized fit  Designed to look baggy ,missing,bottoms
788,Stradivarius trouser with button detail in black,Stradivarius,32.37,     An alternative to your denim  High rise  Elasticated waistband  Faux button detailing      Super-skinny fit   For a streamlined silhouette ,missing,bottoms
789,ASOS 4505 Petite icon legging with bum sculpt seam detail,ASOS 4505,32.38,     For exercise or everyday wear      High rise      Elasticated waistband  4505 branding  Bodycon fit  A tight cut to the body ,missing,bottoms
790,ASOS DESIGN high waist trousers skinny fit in rioja,ASOS DESIGN,35.98,      Put the jeans away for a day    High-rise waist       Zip-side fastening      Jet back pockets  Skinny fit  Cut very closely from hips to hem ,missing,bottoms
791,ASOS DESIGN Tall Woven Peg Trousers with Obi Tie,ASOS DESIGN,39.58,     Part of our responsible edit  High rise  Tie waist      Side pockets      Tapered leg      Regular fit   Just select your usual size ,missing,bottoms
792,The Couture Club tapered jogger in cream,ASOS DESIGN,71.96,     Part of a co-ord set  Sweatshirt sold separately       Drawstring waistband   Branded design       Side pockets      Zip cuffs       Slim fit   A narrow cut from hips to hem ,missing,bottoms
793,New Look Petite pleated trouser in black,New Look,41.36,     Add them to your everyday line-up      High-rise waist  Concealed fly   Button detail       Side pockets       Regular fit  Just select your usual size ,missing,bottoms
794,Ellesse tracksuit bottoms with geo print drawcords co-ord,ellesse,71.96,      Part of a co-ord set    Jacket sold separately     Drawstring waistband       Side pockets  Ellesse logo  Fitted draw-cord cuffs  Regular fit  Just select your usual size  Exclusive to ASOS ,missing,bottoms
795,Nike Training one luxe in navy and rose gold,Nike,107.95,"     Activewear, but make it fashion      High rise      Elasticated waistband  Rose-gold Swoosh logo to lower left hem      Bodycon fit  A tight cut to the body  ",missing,bottoms
796,Dare 2b X Julien Macdonald Ladyship ski pant in black,Dare 2b,287.86,"     Collaboration with Julien Macdonald  Fleece lining  Concealed zip fly  Functional pockets  Side panels with branded print  Interior snow gaiter  Zipped gusset at hem  Slim fit  Close-fitting, regular on the waist ",missing,bottoms
797,Fashion Union plus blazer & trousers with scallop detail co-ord,Dare 2b,149.33,missing,missing,bottoms
798,Only wide leg cord trousers in green,Only,62.97,      Add them to your everyday line-up    Regular rise   Concealed fly  Button fastening  Side and back pockets  Wide leg  Relaxed fit  For a slouchy silhouette  ,missing,bottoms
799,ASOS DESIGN Basic Kick Flare Leggings,ASOS DESIGN,28.79,     High rise  Just like your standards  Flared hem  Bodycon fit  Holds you close ,missing,bottoms
800,Lipsy lounge knitted jogger in grey,Lipsy,57.57,"     Your casual vibe, sorted  Drawstring waistband  Ribbed finish  Regular fit  Just select your usual size ",missing,bottoms
801,ASOS 4505 high waisted legging in high shine,ASOS 4505,50.37,     For exercise or everyday wear  Elasticated waistband  Small logo detail  High-shine finish      Close-cut bodycon fit ,missing,bottoms
802,Puma Wide Leg Trousers with Split in Black,PUMA,80.96 ,"     Your casual vibe, sorted      Mid-rise elasticated waist  Contrast taping       Side pockets  Split sides       Wide-cut leg  Relaxed fit  For a slouchy silhouette ",missing,bottoms
803,ASOS DESIGN Petite wide leg cargo trouser with split side,ASOS DESIGN,53.97,"     They've already got your attention      High-rise waist      Zip fly with button fastening      Side splits   Wide leg  Fitted at the top, flowing at the bottom ",missing,bottoms
804,ASOS DESIGN Curve wide leg suit trousers,ASOS DESIGN,44.98,"     Worth making plans for  High rise  Concealed fly  Wide leg  Fitted at the top, flowing at the bottom ",missing,bottoms
805,Nike black ribbed just do it high waisted leggings,Nike,62.97 ,"     For your daytime thing  High rise  Branded, stretch waistband  Bodycon fit  A tight cut to the body ",missing,bottoms
806,ASOS DESIGN check jacquard skinny trouser,ASOS DESIGN,50.37,     Add-to-bag potential: considerable  High rise  Stretch waistband       Check design   Skinny fit  Cut closely from hips to hem ,missing,bottoms
807,Noisy May Tall cord straight leg trousers in navy,Noisy May,68.37,      Add them to your everyday line-up    High rise   Belt loops  Button fastening  Concealed fly   Side pockets  Straight leg  Regular fit  Just select your usual size ,missing,bottoms
808,COLLUSION checker board jogger,COLLUSION,39.58,      For your daytime thing    High rise    Drawstring waistband       Functional pockets  Printed design      Fitted cuffs  Regular fit  Just select your usual size ,missing,bottoms
809,Weekday smart trousers in dark green,Weekday,80.96,     A smarter alternative to your denim  High rise  Concealed fly  Functional pockets  Wide-cut leg  Relaxed fit  Loose but not oversized ,missing,bottoms
810,ASOS DESIGN co-ord square neck bralet and wide leg trouser in slinky,Weekday,61.17,missing,missing,bottoms
811,Mamalicious maternity 3/4 sports legging,Mama.Licious,39.58,     For exercise or everyday wear      High-rise waist      Elasticated waistband      Close-cut bodycon fit      Designed to fit you from bump to baby ,missing,bottoms
812,Reebok Training with taping detail set,Mama.Licious,104.35,missing,missing,bottoms
813,Nike Yoga Seamless Set in Pink,Mama.Licious,147.53,missing,missing,bottoms
814,Monki wide leg sweatpants in grey,Monki,71.96,      Part of our responsible edit    Drawstring waistband        Functioning pockets   Contrast trims  Relaxed fit  Think baggy and casual ,missing,bottoms
815,ASOS DESIGN tracksuit ultimate sweat / basic jogger in premium neppy,ASOS DESIGN,61.17,"     Your casual vibe, sorted  Crew neck   Long sleeves   Fitted cuffs       Stretch waistband       Side pockets      Elasticated cuffs      Regular fit  Just select your usual size ",missing,bottoms
816,ASOS DESIGN lounge mix & match chenille knitted legging,ASOS DESIGN,50.37,      For 24/7 glam    Ribbed finish    High rise        Elasticated waistband      Close-cut bodycon fit ,Cream,bottoms
817,ASOS DESIGN Tall high waisted stretch treggings in ponte,ASOS DESIGN,32.38,     An alternative to your jeans      High-rise waist  Concealed fly  Functional pockets  Skinny fit  Cut very closely from hips to hem ,missing,bottoms
818,ASOS DESIGN split sleeve suit in stone,ASOS DESIGN,161.92,missing,missing,bottoms
819,ASOS DESIGN chino trousers in navy,ASOS Collection,39.58,     Woven cotton  Mid-rise waist      Zip fly with button fastening      Side pockets  Straight leg      Slim fit - cut close to the body  Machine wash  ,missing,bottoms
820,River Island Plus high waisted cigarette trousers in pink,River Island,57.57,"     Go out, stand out   High-rise waist  Button front  Side pockets  Regular, tapered fit  A standard cut around the thigh with a narrow shape through the leg ",missing,bottoms
821,ASOS DESIGN Tall check jacquard peg trouser,ASOS DESIGN,44.98,"     Add them to your everyday line-up      High rise  Stretch waistband       Check design        Regular, tapered fit   A standard cut around the thigh with a narrow shape through the leg ",missing,bottoms
822,COLLUSION neon camo jacquard wide leg trouser,COLLUSION,35.98,"     They've already got your attention      High rise  Elasticated waistband       Side pockets      Neon design  Wide leg  Fitted at the top, flowing at the bottom ",missing,bottoms
823,ASOS DESIGN wide leg trousers with coconut effect trim,ASOS DESIGN,57.57,"     Worth making plans for       High rise  Concealed fly   Belted waist   Wide leg  Fitted at the top, flowing at the bottom ",missing,bottoms
824,Selected Femme high waist straight leg leather trousers,Selected,449.78,     Add-to-bag potential: considerable      High-rise waist      Concealed fly       Side pockets and two back pockets       Regular fit  Just select your usual size ,missing,bottoms
825,The Girlcode satin wide leg trouser in blue,The Girlcode,62.97,"     They’re everything you’ve been scrolling for  Mid-rise waist  Wide leg  Fitted at the top, flowing at the bottom ",missing,bottoms
826,ASOS DESIGN belted peg trousers with tortoiseshell buckle,ASOS DESIGN,50.37,     A fail-safe pair      High-rise waist      Zip fly  Removable tie belt      Side pockets      Tapered fit  Cut loosely around the thigh and tapered from the knee to the ankle   Part of the Eco Edit  ,missing,bottoms
827,ASOS DESIGN Petite ultimate jersey peg trousers,ASOS DESIGN,28.79,     A wardrobe staple  High rise  Stretch waist  Side pockets  Tapered fit  Cut loosely around the thigh and tapered from knee to ankle ,missing,bottoms
828,Puma after glow track jacket in black,PUMA,125.94,     Add-to-bag potential: considerable      Drawstring hood  Raglan sleeves      Zip fastening  Branded design       Functional pockets      Regular fit  Just select your usual size ,missing,bottoms
829,Y.A.S belted wide leg trouser,Y.A.S,86.36,"     Add-to-bag potential: considerable  Belted waist  Concealed fly  Functional pockets  Wide leg  Fitted at the top, flowing at the bottom ",missing,bottoms
830,ASOS DESIGN slinky rib tracksuit set,Y.A.S,68.37, Tracksuit set  An entire look in one purchase  Ribbed ifnish  Plain sweatshirt  V-neck   Long sleeves with tie cuffs    Cropped length   Legging bottoms  Stretch waistband   Fitted cuffs   Slim fit  Cut close to the body ,missing,bottoms
831,Another Reason Plus relaxed trousers in plisse co-ord,Y.A.S,44.98," Plus-size trousers by Another Reason<ul>      Part of a co-ord set       Top sold separately      Elasticated waistband      Wide leg      Fitted at the top, flowing at the bottom      Exclusive to ASOS </ul> ",missing,bottoms
832,ASOS DESIGN co-ord christmas fairisle knitted trousers,ASOS DESIGN,50.37,      'Tis the season     Christmas design     High-rise waist       Elasticated waistband      Close-cut bodycon fit ,missing,bottoms
833,adidas Training Three Stripe Leggings In Black,adidas,53.97,"     Activewear, but make it fashion      Elasticated waistband  adidas branding      Close-cut bodycon fit ",missing,bottoms
834,ASOS DESIGN co-ord legging in acid wash,ASOS DESIGN,28.79,      Part of our responsible edit    Part of a co-ord set    Top sold separately     High rise    Elasticated waistband       Bodycon fit  A tight cut to the body  ,missing,bottoms
835,Puma XTG Leggings in Black,PUMA,71.96,     For exercise or everyday wear      High rise      Stretchy waistband  Contrast side panels  PUMA logo print to left thigh and calves   Bodycon fit   A tight cut to the body ,missing,bottoms
836,South Beach rib seamless leggings in blue,South Beach,25.19,     For exercise or everyday wear  Stretch waistband  Ribbed finish  Bodycon fit  A tight cut to the body ,missing,bottoms
837,ASOS DESIGN shell joggers in khaki colour block,ASOS DESIGN,57.57,     For your daytime thing  High rise  Stretch waist  Side pockets  Fitted cuffs  Regular fit  Just select your usual size ,missing,bottoms
838,Spanx Plus faux leather high waist sculpting leggings,Spanx,160.12,      For that thing you have to go to    High rise       Stretch waistband  Bodycon fit  A tight cut to the body ,missing,bottoms
839,Fashion Union plus straight leg trouser with scallop waist detail co-ord,Fashion Union,62.97,      Part of a co-ord set    Blazer sold separately    High-rise waist    Scalloped detail    Button fastening        Side pockets    Wide-cut leg       Regular fit  Just select your usual size ,missing,bottoms
840,ASOS DESIGN skinny fit trousers with pocket detail,ASOS DESIGN,50.37,     Add-to-bag potential: considerable      High-rise waist      Zip fly with button fastening      Functional pockets       Skinny fit   Cut very closely from hips to hem ,missing,bottoms
841,Spanx Mama ankle grazer jean-ish leggings,ASOS DESIGN,172.71," <a href=""https://www.asos.com/women/jeans/jeggings/cat/?cid=19057""><strong>Jeggings</strong></a> by Spanx Maternity<ul>      It's all in the jeans   Over-the-bump waistband  Two back pockets  Skinny fit  Cut very closely from hips to hem </ul> ",missing,bottoms
842,AllSaints Soft Tailored Peg Trousers,AllSaints,176.31,"     Add them to your everyday line-up  High rise      Side pockets      Stretch-back waistband  Cropped length  Slim, tapered fit  A close cut around the thigh with a slim shape through the leg ",missing,bottoms
843,ASOS DESIGN petite pop suit in pop yellow,AllSaints,151.12,missing,missing,bottoms
844,Weekday Mira quilted trousers in black,Weekday,89.96,     For your daytime thing  Quilted finish  High rise  Concealed fly  Button fastening  Functional pockets  Fitted cuffs  Relaxed fit  For a slouchy silhouette ,missing,bottoms
845,Fashionkilla flared trouser in lilac,Fashionkilla,46.78,     They've already got your attention      High rise waist  Wide-cut leg  Flared shape  Cut with a skinny leg that flares at the knee  Exclusive to ASOS ,missing,bottoms
846,ASOS DESIGN tracksuit sweat with half zip / jogger with printed tape,Fashionkilla,64.77,     Part of our responsible edit       Funnel neck  Half-zip design   Printed taping   Cropped length  Drawstring waist      Fitted cuffs  Regular fit  Just select your usual size ,missing,bottoms
847,Under Armour logo leggings in black,Under Armour,80.96,"      Activewear, but make it fashion    High rise        Logo design    Cropped cut  Bodycon fit  A tight cut to the body ",missing,bottoms
848,PrettyLittleThing jogger with reflective tape trim in blush,PrettyLittleThing,35.98,"     Your casual vibe, sorted  Belted waist  Reflective taping under flash light  Fitted cuffs  Regular fit  Just select your usual size ",missing,bottoms
849,Missguided sequin high waisted flare trousers in black,Missguided,57.57,"     Worth making plans for  High rise  Stretch waistband  Skinny fit  Regular on the waist, flared at the knee ",missing,bottoms
850,Warehouse slim leg trousers in orange check,Warehouse,70.16,"     Give your jeans a day off  Check pattern  High-rise waist      Concealed fly       Side and jet back pockets  Slim fit  A close cut, regular on the waist ",missing,bottoms
851,New Look buckle detail cropped trousers in white,New Look,41.36,"     Add them to your everyday line-up      High rise  Belted waist      Side pockets      Cropped length  Wide leg  Fitted at the top, flowing at the bottom ",missing,bottoms
852,ASOS DESIGN Petite chino trousers,ASOS DESIGN,35.98,"     Part of our responsible edit  Button fastening  Concealed fly  Functional pockets  Regular, tapered fit  A standard cut around the thigh with a narrow shape through the leg ",missing,bottoms
853,New Look crop trousers with buckle in rust,New Look,41.36,     Add-to-bag potential: considerable      High-rise waist      Elasticated waistband  Removable belt   Side pockets      Cropped leg      Regular fit  Just select your usual size ,missing,bottoms
854,ASOS DESIGN lounge premium knitted jumper & wide leg trouser,New Look,116.94,missing,missing,bottoms
855,Fashion Union tailored wide leg trouser in black paisley jacquard,Fashion Union,57.57,"      They've already got your attention    Paisley design   High-rise waist      Concealed fly  Wide leg  Fitted at the top, flowing at the bottom ",missing,bottoms
856,Native Youth wide leg trousers in abstract smudge print,Native Youth,62.97,"     Add-to-bag potential: considerable  High rise  Side pockets  Zip-back fastening  Wide leg  Fitted at the top, flowing at the bottom ",missing,bottoms
857,PrettyLittleThing cargo trousers with reflective tape in black,PrettyLittleThing,32.38,     For your daytime thing      High rise      Elasticated waistband      Functional pockets  Fitted cuffs  Regular fit  Just select your usual size ,missing,bottoms
858,In The Style x Stephsa Plus pu paperbag waist trouser with belt in black,In The Style,53.97,     Collaboration with Stephsa      High rise  Paper-bag waist       Side pockets       Regular fit  Just select your usual size ,missing,bottoms
859,ASOS DESIGN Tall wide leg trousers with clean high waist,ASOS DESIGN,44.98,"     They’re everything you’ve been scrolling for  High-rise waist  Side-zip fastening  Wide leg  Fitted at the top, flowing at the bottom ",missing,bottoms
860,ASOS DESIGN Curve wide leg trousers with clean high waist,ASOS DESIGN,44.98,"     They’re everything you’ve been scrolling for  High-rise waist  Plain design  Wide leg  Fitted at the top, flowing at the bottom ",missing,bottoms
861,South Beach high waisted leggings in pink,South Beach,35.98,"     Activewear, but make it fashion      High rise       Wrap-style, elasticated waistband  Bodycon fit  A tight cut to the body  Exclusive to ASOS ",missing,bottoms
862,Sisters Of The Tribe high waist trousers in embroidered lace,Sisters of the Tribe,53.97,"     Worth making plans for  High rise  Concealed fly  Tie detail to hem  Wide leg  Fitted at the top, flowing at the bottom  Exclusive to ASOS ",missing,bottoms
863,Columbia Roffe Ridge ski pant in white,Columbia,161.92,"     Part of our responsible edit  Waterproof, windproof and breathable  Allows water vapour to escape to help keep you cool and dry  Mid-rise waist  Zip and press-stud fly   Articulated knees    Functional pockets    Interior leg gaiter    Zipped cuffs   Slim fit  Close-fitting cut, regular on the waist ",missing,bottoms
864,Fila tailored trousers with logo in cord,Fila,107.95,     For your daytime thing  High rise  Concealed fly  Functional pockets  Straight leg  Regular fit  Just select your usual size ,missing,bottoms
865,Bershka cargo trouser with belt in camo print,Bershka,46.76,      Add them to your everyday line-up    Camouflage print   High rise  Belt detail  Side pockets  Logo to leg  Fitted hems  Regular fit  Just select your usual size ,missing,bottoms
866,ASOS EDITION tailored suit in ivory,Bershka,269.86,missing,missing,bottoms
867,River Island satin utility joggers in khaki,River Island,50.37,      Add them to your everyday line-up    High rise    Belted waist    Side pockets   Cargo-style pockets  Regular fit  Just select your usual size ,missing,bottoms
868,ASOS DESIGN co-ord slinky flare trouser,ASOS DESIGN,32.38,"      Part of a co-ord set     Top sold separately     High rise   Skinny fit  Regular on the waist, flared at the knee ",missing,bottoms
869,PrettyLittleThing wide leg glitter trouser in silver,PrettyLittleThing,44.98,"     Worth making plans for  High rise  Wide leg  Fitted at the top, flowing at the bottom ",missing,bottoms
870,COLLUSION Collusion satin jogger in check print co-ord,COLLUSION,44.98,      Part of a co-ord set   Shirt sold separately  High rise  Adjustable waist   Functional pockets  Fitted cuffs  Regular fit  Just select your usual size ,missing,bottoms
871,ASOS EDITION high waist mansy suit trouser,ASOS EDITION,116.94,"     Worth making plans for      High-rise waist      Zip fly with hook-and-bar fastening  Belt loops      Side pockets  Wide leg  Fitted at the top, flowing at the bottom ",missing,bottoms
872,Unique21 satin blazer & high waist wide leg trousers co-ord,ASOS EDITION,131.33,missing,missing,bottoms
873,Missguided co-ord ribbed joggers in white,Missguided,44.98,      Part of a co-ord set   Hoodie sold separately      Stretch waistband      Fitted cuffs  Regular fit  Just select your usual size ,missing,bottoms
874,Y.A.S Tall wide leg trousers in burgundy,Y.A.S,89.96,      Give your jeans a day off    Mid-rise waist   Tie fastening  Side pockets  Wide leg  Regular fit on the waist ,missing,bottoms
875,ASOS DESIGN x Christian Cowan logo nylon track top and joggers co-ord,Y.A.S,152.92,missing,missing,bottoms
876,Y.A.S Petite tailored trousers in beige,Y.A.S. ,98.95,     For your daytime thing  Mid-rise waist  Concealed fly  Side pockets  Tailored style  Regular fit  Just select your usual size ,missing,bottoms
877,Topshop faux leather skinny trousers in black,Topshop,64.77,     An alternative to your denim  High-rise waist  Zip-side fastening  Skinny fit  Cut very closely from hips to hem ,missing,bottoms
878,ASOS DESIGN Tall tie waist peg casual trouser,ASOS DESIGN,39.58,"     Put the jeans away for a day      High rise  Belted, stretch-back waist      Concealed fly  Side pockets      Single back pocket      Regular fit  True to size  Part of the Eco Edit ",missing,bottoms
879,River Island flared trousers in black,River Island,71.96,      Add them to your everyday line-up    High-rise waist        Concealed fly    Faux-crystal embellished button    Side pockets       Wide-cut leg      Regular fit  Just select your usual size ,missing,bottoms
880,adidas Training logo leggings in blue,adidas,62.97,     Level up your activewear  High rise  Elasticated waistband  Branded design  Mesh panels for added breathability  Bodycon fit  A tight cut to the body ,missing,bottoms
881,ASOS DESIGN ultimate jersey harem trousers,ASOS DESIGN,28.79,     Put the jeans away for a day      High-rise waist      Just like your standards      Side pockets      Fitted cuffs      Relaxed fit       Loose but not oversized ,missing,bottoms
882,Missguided cargo trousers in black,Missguided,50.37,     For your daytime thing  High rise  Concealed fly with button fastening  Functional pockets  Fitted cuffs  Regular fit  Just select your usual size ,missing,bottoms
883,ASOS 4505 Curve mesh panel legging,ASOS 4505,39.58,"     Activewear, but make it fashion      High rise  Stretchy waistband  4505 branding with contrast tipping      Bodycon fit       A tight cut to the body ",missing,bottoms
884,The Couture Club contrast panel tapered jogger in mauve,ASOS 4505,71.96,"      Add-to-bag potential: considerable   Drawstring waistband  Side pockets   Small logo   Regular, tapered fit  A standard cut around the thigh with a narrow shape through the leg ",missing,bottoms
885,Stradivarius tailored trousers with belt in pink,Stradivarius,35.96,     Add-to-bag potential: considerable  High-rise waist  Belt detail  Tailored style  Regular fit  Just select your usual size ,missing,bottoms
886,ASOS DESIGN Petite mono floral print flare trouser,ASOS DESIGN,32.38,"      Give your jeans a day off    High rise    Stretch waistband        Slim fit   Regular on the waist, flared at the knee ",missing,bottoms
887,Ellesse cuffed tracksuit bottoms with neon side taping co-ord,ellesse,71.96,      Part of a co-ord set   Sweatshirt sold separately      Drawstring waistband       Side pockets  Fitted cuffs  Regular fit  Just select your usual size   Exclusive to ASOS  ,missing,bottoms
888,ASOS DESIGN Tall lounge brushed grey jogger,ASOS DESIGN,35.98,"      Your casual vibe, sorted    Drawstring waist       Side pockets  Fitted cuffs  Regular fit  Just select your usual size ",missing,bottoms
889,ZYA ruched track pants with contrast pockets,ZYA,80.96,     For your daytime thing      High rise  Drawstring waist      Zip pockets   Ruched design      Regular fit  Just select your usual size ,missing,bottoms
890,Object leather straight leg trousers,Object,323.84,      Add-to-bag potential: considerable    High rise   Belt loops   Button fastening  Concealed fly   Straight leg  Regular fit  Just select our usual size ,missing,bottoms
891,ASOS DESIGN Maternity basic jersey smart skinny trousers in ponte with bump band,ASOS DESIGN,32.38,     Smart/casual personified  In-built over-the-bump band   Functional pockets  Skinny leg  Regular fit       Designed to fit through all stages of pregnancy ,missing,bottoms
892,ASOS DESIGN Petite basic wide leg joggers,ASOS DESIGN,35.98,     Comfort is key  Drawstring waist  Side pockets  Wide-cut leg      Relaxed fit  Loose but not oversized ,missing,bottoms
893,Juicy Couture gothic logo joggers,Juicy Couture,142.13, Part of a co-ord set  Hoodie sold separately  Elasticated waist  Juicy Couture branding to leg  Cropped length  Slim fit  A narrow cut from hem to hips ,missing,bottoms
894,Vero Moda paperbag wide leg trousers in black,Vero Moda,50.37,     For your daytime thing      High rise       Tie waist   Wide-fit design  Because we know one size doesn’t fit all ,missing,bottoms
895,ASOS DESIGN Petite basic stretch super skinny joggers in organic cotton,ASOS DESIGN,28.79,     Part of our responsible edit       Stretch waistband       Plain design       Fitted cuffs  Skinny fit  Cut very closely from hips to hem ,missing,bottoms
896,Miss Selfridge kickflare trousers in green,Miss Selfridge,44.98,     Easily dressed up or down      High rise      Side zip fastening  Cropped length      Flared shape  Cut with a slim leg that flares at the knee ,missing,bottoms
897,ASOS DESIGN high waist cigarette trousers with belt in pink check,ASOS DESIGN,50.37,     An alternative to your jeans      Belted waist  Side pockets  Cropped length  Slim fit  A narrow cut from hips to hem ,missing,bottoms
