,title,brand,price,description,colour,category
0,ASOS DESIGN Petite lounge jogger,asos petite,35.98,     Drawstring waistband      Welcome to the cosy life      Side pockets      Fitted cuffs      Relaxed fit      Think baggy and casual ,Black,bottoms
1,ASOS DESIGN shell jogger in navy colour block,ASOS DESIGN,57.57,     Throw on and go  Stretch waistband      Side pockets      Fitted cuffs      Regular fit  Just pick your usual size ,Navy,bottoms
2,ASOS 4505 neon colourblock legging with bum sculpt seam detail,ASOS 4505,39.58," Activewear, but make it fashion  Colour-block design  High rise  Elasticated waistband  Sculpting design  4505 logo to reverse  Bodycon fit  A tight cut to the body  ",Black/neon yellow,bottoms
3,Puma Iridescent Joggers,PUMA,107.95,      For the gym or your everyday thing    Drawstring waistband   Side pockets  PUMA logo  Fitted cuffs  Regular fit  True to size ,missing,bottoms
4,Tommy Jeans organic jogger pant,Tommy Jeans Capsule,116.94,     Part of our responsible edit  High rise  Drawstring waist  Functional pockets  Fitted cuffs  Slim fit   Cut close to the body ,Tommy black,bottoms
5,River Island Petite cigarette trousers in coral,River Island,64.77,"     Surprise your monochrome palette with these   Mid rise        Concealed fly with button fastening      Side pockets  Regular, tapered fit  A standard cut around the thigh with a narrow shape through the leg ",Coral,bottoms
6,New Look high waist paperbag trousers in black,New Look,35.96,     Coming soon to your Saved Items  Paper-bag waist  Side pockets  Regular fit  True to size  ,Black 1,bottoms
7,ASOS DESIGN premium pinstripe suit mensy trousers,ASOS DESIGN,68.37,     Add-to-bag potential: considerable      High-rise waist      Concealed fly       Side pockets  Pinstripe design       Regular fit  Just select your usual size ,Pinstripe,bottoms
8,ASOS DESIGN textured wide leg trouser with buckle,ASOS DESIGN,53.97,"     Easily dressed up or down  High rise  Belted waist  Wide leg  Fitted at the top, flowing at the bottom ",Blue,bottoms
9,Monki wide leg cropped trousers in beige,Monki,53.97," New garms?  We’ve got you covered  High-rise waist  Concealed fly  Wide-cut leg  Fitted at the top, flowing at the bottom ",Beige,bottoms
10,ASOS DESIGN Petite crop sweat and jogger tracksuit with neon piped detail,Monki,61.17,     Part of our responsible edit  Tracksuit set  Crew neck  Neon piping  Ribbed trims  Cropped length  Jogging bottoms  Drawstring waist  Functional pockets  Fitted cuffs  Regular fit  Just select your usual size ,Black,bottoms
11,Lavish Alice corset detail mid rise trousers in mink,Lavish Alice,125.94,      For that thing you have to go to     Mid-rise waist        Concealed fly    Jet back pockets       Hook-and-eye detail      Regular fit  True to size ,Beige,bottoms
12,Reclaimed Vintage inspired quilted jogger in silver,Reclaimed Vintage,62.97,     They've already got your attention      Drawstring waist  Side pockets  Fitted cuffs  Relaxed fit  For a slouchy silhouette  Exclusive to ASOS ,missing,bottoms
13,Rare London glitter flare trouser co ord,Rare,80.96, Part of a co-ord set  Blazer sold separately      High rise        Side-zip fastening   Flared shape  Cut with a skinny leg that flares at the knee ,missing,bottoms
14,Weekday regina PU wide leg trouser in black,Weekday,80.96,"     Easily dressed up or down  High-rise waist  Concealed fly  Functional pockets  Wide leg  Fitted at the top, flowing at the bottom ",missing,bottoms
15,ASOS DESIGN slinky co-ord in khaki,Weekday,64.77,missing,missing,bottoms
16,Hollister structured utility jogger in camo,Weekday,70.16,     They've already got your attention  Camouflage print       High rise       Side and back pockets      Fitted cuffs  Regular fit  Just select your usual size ,missing,bottoms
17,ASOS DESIGN beach trousers with tiered ruffle hem in white,Weekday,44.98,     For that holiday you haven't booked yet  Semi-sheer finish      High rise  Stretch-back waistband      Ruffle hem      Regular fit  Just select your usual size ,missing,bottoms
18,Puma High Waisted Joggers in red exclusive at ASOS,PUMA,89.96,"     Coming soon to your Saved Items  Drawstring waist  Contrast piping and logo  Side pockets  Fitted cuffs  Regular, tapered fit  A standard cut around the thigh with a narrow shape through the leg  Exclusive to ASOS ",missing,bottoms
19,Oasis faux leather cigarette trousers in black,Oasis,71.96,      Add-to-bag potential: considerable    Regular rise    Concealed fly with hook-and-bar fastening        Side pockets      Regular fit  Just select your usual size ,missing,bottoms
20,ASOS DESIGN grunge belted peg trouser in check,ASOS DESIGN,62.97,     Cue the party playlist  Checked design  High rise  Belted waist  Functional pockets  Elasticated cuffs  Regular fit  Just select your usual size ,missing,bottoms
21,Nike black wide leg high waist joggers,Nike,86.36,"     Your casual vibe, sorted   High rise      Drawstring waistband       Side pockets  Nike Swoosh logo       Wide leg   Fitted at the top, flowing at the bottom ",missing,bottoms
22,ASOS DESIGN Petite exaggerated 80s tapered suit trousers in coral,ASOS DESIGN,57.57,"     Worth making plans for  Fully lined  High-rise waist  Concealed fly  Side pockets  Regular, tapered fit  A standard cut around the thigh with a narrow shape through the leg ",missing,bottoms
23,Reebok Training colourblock leggings in navy and beige,Reebok,62.97,"     Level up your activewear      Colour-block design      Elasticated, wide-cut waistband      Signature Reebok branding       Bodycon fit      A tight cut to the body ",missing,bottoms
24,Stradivarius rustic pants in Beige,Stradivarius,53.96,     Put the jeans away for a day off      High rise  Belted waist      Concealed fly      Functioning pockets      Cropped leg  Regular fit  Just select your usual size ,missing,bottoms
25,Simonett Comma PU wide leg trousers,Simonett,187.11,"      For that thing you have to go to    High rise   Stretch waistband  Concealed fly       Functional pockets   Wide leg  Fitted at the top, flowing at the bottom ",missing,bottoms
26,Wolf & Whistle tie curve dye sports bra and leggings with mesh panel in pink,Simonett,107.95,missing,missing,bottoms
27,Public Desire Curve relaxed tracksuit bottoms in acid wash co-ord,Public Desire,41.36,     Part of a co-ord set      Top sold separately       Stretch waist       Acid wash   Relaxed fit  For a slouchy silhouette  ,missing,bottoms
28,ASOS DESIGN Petite wide leg trousers with clean high waist,ASOS DESIGN,44.98,     Put the jeans away for a day  High rise  Elasticated waistband  Wide leg  Regular fit  Just select your usual size  ,missing,bottoms
29,Nike burgundy snake print woven joggers,Nike,86.36,      Add-to-bag potential: considerable    Snake print   Drawstring waist  Fitted cuffs  Regular fit  Just select your usual size ,missing,bottoms
30,ASOS DESIGN belted dad suit,Nike,156.52,missing,missing,bottoms
31,ASOS DESIGN Tall jersey basic wide leg trousers,ASOS DESIGN,35.98,     Plain design   Why complicate things?  High-rise waist  Elasticated waistband      Wide-cut leg  Regular fit - true to size ,missing,bottoms
32,Puma Heavy Fleece Joggers in Beige,PUMA,98.95 ,"     Your casual vibe, sorted  Drawstring waistband  Side pockets  Fitted cuffs  Regular fit  Just select your usual size  Exclusive to ASOS ",missing,bottoms
33,ASOS DESIGN tracksuit sweat / basic jogger with tie with contrast binding,PUMA,57.57,     Part of our responsible edit  Tracksuit set  Lightweight sweatshirt  Crew neck  Matching joggers  Drawstring waistband  Contrast binding  Fitted cuffs  Regular fit  Just select your usual size ,missing,bottoms
34,ASOS DESIGN lounge travel high waist legging,ASOS DESIGN,25.19,"     Your casual vibe, sorted   High rise       Elasticated waistband       Skinny fit   Cut very closely from hips to hem ",missing,bottoms
35,ASOS DESIGN lace up side vinyl skinny trouser,ASOS DESIGN,50.37 ,     Worth making plans for       High rise  Stretch waist  Lace-up sides   Skinny fit  Cut very closely from hips to hem ,missing,bottoms
36,ASOS DESIGN Petite basic jersey smart skinny trousers in ponte,ASOS DESIGN,32.38,"     For doing your office thing, or when you clock off      High-rise waist  Elasticated to back       Zip fly with hook and bar fastening      Side pockets      Cropped cut   Skinny fit   Cut closely from hips to hem ",missing,bottoms
37,COLLUSION mixed print trousers,COLLUSION,39.58,"     They've already got your attention  Mixed prints      Drawstring waist  Wide leg  Fitted at the top, flowing at the bottom ",missing,bottoms
38,ASOS DESIGN tracksuit jogger with you print co-ord,ASOS DESIGN,62.97,     Part of a co-ord set  Jacket sold separately       Stretch waistband       Side pockets  Printed design      Fitted cuffs      Regular fit  Just select your usual size ,missing,bottoms
39,New Look Maternity seamless legging,New Look Maternity,17.97,     One for your wardrobe      High-rise waist to support your growing bump  Seamless design      Close-cut bodycon fit      Designed to fit through all stages of pregnancy ,missing,bottoms
40,ASOS DESIGN Maternity slim leg combat trousers in black with under bump waistband,ASOS DESIGN,50.37,      Add them to your everyday line-up    Combat style     Jersey bump waistband    Side and back pockets  Slim fit  A narrow cut from hips to hem      Designed to fit through all stages of pregnancy ,missing,bottoms
41,ASOS DESIGN Petite tailored clean culottes,ASOS DESIGN,44.98,"     An alternative to your jeans  High-rise waist  Functional pockets  Zip-side fastening  Midi length  Wide leg  Fitted at the top, flowing at the bottom ",missing,bottoms
42,COLLUSION trousers with relfective panel,COLLUSION,44.98,     Part of our responsible edit      High rise       Drawstring waistband    Functional pockets with u tility-style pockets to leg  Reflective detailing  Fitted cuffs  Regular fit  Just select your usual size ,missing,bottoms
43,ASOS DESIGN Tall oil wash combat trouser,ASOS DESIGN,62.97,"     Part of our responsible edit   High rise  Elasticated waistband  Belt loops  Zip fly  Side pockets and single back pocket  Contrast cargo pockets  Elasticated cuffs  Regular, tapered fit  A standard cut around the thigh with a narrow shape through the leg ",missing,bottoms
44,PrettyLittleThing vinyl wide leg trouser in black,PrettyLittleThing,50.37,"     It's high-shine season      High rise  Tie waist  Zip front with ring pull  Wide leg  Fitted at the top, flowing at the bottom ",missing,bottoms
45,New Look Petite crop trousers with belt in rust,New Look,41.36,"     Add them to your everyday line-up      High rise  Belted waist      Side pockets      Wide leg  Fitted at the top, flowing at the bottom ",missing,bottoms
46,ASOS DESIGN tailored clean culottes,ASOS DESIGN,44.98,"      Put the jeans away for a day    High-rise waist        Zip-side fastening    Side and back pockets       Cropped, wide-cut leg      Regular fit  Just select your usual size ",missing,bottoms
47,ASOS DESIGN Petite Woven Peg Trousers with Obi Tie,ASOS DESIGN,39.58,"     Part of our responsible edit  High-rise waist  Obi-tie closure  Concealed fly  Side pockets  Regular, tapered fit  A standard cut around the thigh with a narrow shape through the leg ",missing,bottoms
48,COLLUSION Unisex reflective joggers with typo print,COLLUSION,62.97,      Nothing understated here    Stretch waistband       Side pockets      Fitted cuffs  Relaxed fit  Falls loosely over the body  Unisex style ,missing,bottoms
49,ASOS 4505 ski seamless base layer top and legging in blue cheetah print,COLLUSION,71.96,missing,missing,bottoms
50,ASOS DESIGN Petite co-ord knitted jogger with tipping,ASOS DESIGN,53.97,     Part of a co-ord set  Jumper sold separately  Stretch waistband      Side stripe       Fitted style       Regular fit  Just select your usual size ,missing,bottoms
51,PrettyLittleThing leggings with slogan trim in grey,PrettyLittleThing,26.99,      For your daytime thing     High rise       Elasticated waistband  Slogan trim  Super-skinny fit  An extra-tight cut from hips to hem ,missing,bottoms
52,Only tie waist elastic stripe trouser,Only,62.97,     For your daytime thing      High rise  Drawstring waistband       Functional pockets       Cropped length  Regular fit  Just select your usual size ,missing,bottoms
53,Monki cuffed peg trousers in silver,Monki,53.97,"     Coming soon to your Saved Items      High rise      Stretch waistband       Side pockets       Regular, tapered fit   A standard cut around the thigh with a narrow shape through the leg ",missing,bottoms
54,Wolf & Whistle tie dye set in purple,Monki,107.95,missing,missing,bottoms
55,ASOS DESIGN Maternity washed soft twill tie waist casual trouser with under the bump waistband,ASOS DESIGN,39.58,     Add them to your everyday line-up  Under-bump waistband  Tie waist  Functional pockets  Regular fit  Just select your usual size      Designed to fit you from bump to baby ,missing,bottoms
56,New Girl Order relaxed joggers in all over floral print co-ord,New Girl Order,61.17,      For that thing you have to go to    Floral print    High rise    Stretch waistband        Fitted cuffs   Regular fit  Just select your usual size ,missing,bottoms
57,JDY wide leg rib trousers in grey,JDY,44.98,"      Part of a co-ord set    Top sold separately     High rise   Elasticated waist  Wide leg  Fitted at the top, flowing at the bottom ",missing,bottoms
58,Only curve cargo trousers in khaki,Only,80.96,      Give your jeans a day off    High-rise waist   Belt loops  Concealed fly      Functioning pockets  Regular fit  True to size ,missing,bottoms
59,Vesper tailored trousers co-ord in white,Vesper,62.97,     Part of a co-ord set  Mix and match      High-rise waist      Zip-side fastening  Skinny fit  Cut closely from hips to hem ,missing,bottoms
60,ASOS DESIGN spray on vinyl trouser in pink,ASOS DESIGN,53.97,      They've already got your attention    High-rise waist       Concealed fly with button fastening  Skinny fit  Cut very closely from hips to hem ,missing,bottoms
61,Outrageous Fortune drawstring side wide trouser in sand,Outrageous Fortune,62.97,"     For that thing you have to go to      High rise      Pleated design  Lace-up detailing  Side-zip fastening  Wide leg  Fitted at the top, flowing at the bottom ",missing,bottoms
62,ASOS DESIGN Curve high waist tapered trousers,ASOS CURVE,44.98,     High-rise waist      Just like your standards      Pleat details to front      Side pockets      Zip-side fastening      Tapered leg      Slim fit - cut close to the body ,missing,bottoms
63,Santa Cruz Nolan wide leg chino trousers in white,Santa Cruz,80.96,     Put the jeans away for a day  High-rise waist  Belt loops  Zip fly  Side slip pockets  Buttoned back pockets  Wide leg  Regular fit  Just select your usual size  ,missing,bottoms
64,COLLUSION Unisex borg joggers in neon & borg hoodie,Santa Cruz,98.95,missing,missing,bottoms
65,Nike yellow snake print high waist leggings,Nike,68.37,     Working out just got techy  Snakeskin print      High rise      Zip fly   Nike Swoosh to waist    Flat-lock seams for reduced friction    Close-cut bodycon fit  ,missing,bottoms
66,Pull&Bear cuff detail trousers in check print,Pull&Bear,35.96,     Put the jeans away for a day  Mid-rise waist  Concealed fly  Check print  Side pockets ,missing,bottoms
67,Puma Essentials grey sweat pants,PUMA,44.98,     Add-to-bag potential: considerable  Stretch waistband      Side pockets  PUMA logo      Fitted cuffs      Regular fit  Just select your usual size ,missing,bottoms
68,ASOS DESIGN mix & match lounge wide leg trouser,ASOS DESIGN,39.58,"      For your daytime thing    Ribbed finish   High rise       Stretch waistband   Wide leg  Fitted at the top, flowing at the bottom ",missing,bottoms
69,ASOS DESIGN Petite pop suit in pop blue,ASOS DESIGN,151.12,missing,missing,bottoms
70,Vila cigarette trousers in brown check,Vila,75.56,"      Coming soon to your Saved Items    High-rise waist       Belt loops      Side pockets  Slim fit  Close-fitting, regular on the waist ",missing,bottoms
71,Weekday contrast stitch cargo trousers in khaki green,Weekday,80.96,     Part of our responsible edit  An alternative to your jeans  High rise  Concealed fly  Functional pockets  Contrast stitching  Straight leg  Regular fit  Just select your usual size ,missing,bottoms
72,Stradivarius belted tailored trousers in coral,Stradivarius,53.96,     For your daytime thing       High rise  Belted waist  Concealed fly      Side pockets      Regular fit  Just select your usual size ,missing,bottoms
73,ASOS DESIGN plisse culotte trousers,ASOS DESIGN,39.58,"     For your daytime thing  High rise  Stretch waistband  Wide-cut leg  Cropped length  Relaxed fit  That slouchy, baggy feel ",missing,bottoms
74,Pimkie tailored trousers in black,Pimkie,30.57,     Easily dressed up or down      Mid rise  Elasticated waistband  Side pockets may be tacked  Faux back pocket      Turn-up hem      Slim leg  Regular fit  Just select your usual size ,missing,bottoms
75,ASOS DESIGN snake print plisse culotte,ASOS DESIGN,44.98,      Put the jeans away for a day   Snakeskin print  High-rise stretch waist  Wide-cut leg  Regular fit  Just select your usual size ,missing,bottoms
76,Calvin Klein Performance Active Icon logo waistband leggings in blue,Calvin Klein,125.94,     For exercise or everyday wear      High rise  Branded detailing      Elasticated waistband      Close-cut bodycon fit ,missing,bottoms
77,Only check trousers with tie waist in dark grey,Only,62.97,     Some serious daytime inspiration right here      Drawstring wait      Check design      It's hip to be square      Side pockets      Regular fit - true to size ,missing,bottoms
78,Calvin Klein Buffalo check jogger in red,Calvin Klein,107.95,      Peak snugness    Regular rise   Elasticated waistband  Branded detailing       Functional pockets    Fitted cuffs   Regular fit  Just select your usual size ,missing,bottoms
79,ASOS DESIGN Tall wide leg trousers with pleat detail,ASOS DESIGN,44.98,     Put the jeans away for a day       High-rise waist      Side pockets  Pleated detail       Wide-cut leg      Loose fit - falls loosely over the body  ,missing,bottoms
80,ASOS DESIGN casual animal print trouser with wide waistband,ASOS DESIGN,35.98,"     Add-to-bag potential: considerable  Shirred, stretch waistband  Animal print  Wide leg  Fitted at the top, flowing at the bottom ",missing,bottoms
81,Puma Plus high shine leggings in red Exclusive at ASOS,PUMA,62.97,"     Coming soon to your Saved Items      High rise  Stretch waistband       Small logo        Skinny fit   Tight cut, regular on the waist  Exclusive to ASOS ",missing,bottoms
82,ASOS DESIGN Tall carpenter trouser in acid wash teal,ASOS DESIGN,62.97,      Part of our responsible edit    High rise    Button fastening    Cargo-style pockets   Regular fit  Just select your usual size ,missing,bottoms
83,Daisy Street high waist trousers in cord,Daisy Street,50.36,     For your daytime thing  High rise  Concealed fly  Button fastening  Straight leg  Relaxed fit  For a slouchy silhouette ,missing,bottoms
84,adidas Originals adicolor locked up logo track pants in black,adidas,80.96,"     For your casual thing  High rise   Elasticated waistband  Zipped side pockets   3-Stripe design  Trefoil logo embroidery   Elasticated cuffs  Regular, tapered fit   Just select your usual size ",missing,bottoms
85,ASOS DESIGN Maternity Tall 2 pack high waisted leggings in black,ASOS DESIGN,25.19,     Pack of two  Double up on your favourites  High-rise waist  Plain design  Bodycon fit  A tight cut to the body  Designed to fit you from bump to baby  ,missing,bottoms
86,ASOS DESIGN Hourglass tracksuit cropped sweat / corset waist jogger,ASOS DESIGN,61.17,     Part of our responsible edit   Part of the Hourglass range  Cut with more room around the hips      Crew neck      Dropped shoulders      Jogger bottoms  Side pockets  Fitted cuffs  Regular fit  True to size  ,missing,bottoms
87,New Look Maternity 2 pack leggings in black,New Look Maternity,26.97,     Pack of two  Double up on your favourites       High-rise waist      Elasticated waistband      Close-cut bodycon fit      Designed to fit you from bump to baby ,missing,bottoms
88,Weekday rolanda sweatpants in light beige,Weekday,44.98,      For your daytime thing    High rise    Stretch waistband        Utility-style pockets to leg    Fitted cuffs   Regular fit  Just select your usual size ,missing,bottoms
89,ASOS DESIGN premium supersoft leggings in cotton modal,ASOS DESIGN,21.59,     Super-soft finish  We’re feelin’ it      High rise      Elasticated waistband      Bodycon fit  Holds you close ,missing,bottoms
90,ASOS DESIGN tracksuit hoodie / slim jogger with tie,ASOS DESIGN,57.57,"     Part of our responsible edit  Drawstring hood  Regular fit  Trouser bottoms  Drawstring waistband  Fitted cuffs  Slim fit  A close cut, regular on the waist ",missing,bottoms
91,Vero Moda Petite wide leg cord trousers in pink,Vero Moda Petite,68.37,"      Add them to your everyday line-up    High rise   Concealed fly with button fastening  Side pockets  Wide leg  Fitted at the top, flowing at the bottom ",missing,bottoms
92,ASOS DESIGN Maternity skinny trouser in check jacquard,ASOS DESIGN,44.98,      For your everyday thing    High rise   Elasticated bump band  Check design  Super-skinny fit   An extra-tight cut to the body      Designed to fit through all stages of pregnancy ,missing,bottoms
93,Nike Air Running crop leggings in khaki,Nike,71.96,     Working out just got techy   High rise       Elasticated waistband  Nike Swoosh logo  Zip-back pocket      Close-cut bodycon fit ,missing,bottoms
94,Mamalicious Maternity sports gym leggings in grey marl,Mama.Licious,44.98,     Add-to-bag potential: considerable   High-rise waist       Elasticated waistband      Contrast inserts  Bodycon fit  They've got you covered from bump to baby ,missing,bottoms
95,ASOS DESIGN metallic stripe suit,Mama.Licious,183.50,missing,missing,bottoms
96,ASOS DESIGN oversized bleach wash jogger with rubber trim,ASOS DESIGN,50.37,     Part of our responsible edit  Drawstring waistband  All-over print  Side pockets  Fitted cuffs  Oversized fit  More room for activities ,missing,bottoms
97,Pretty Lavish wide leg trousers in animal print,ASOS DESIGN,86.36,"     For that thing you have to go to  Animal print  High rise      Stretch waistband  Wide leg  Fitted at the top, flowing at the bottom  Exclusive to ASOS ",missing,bottoms
98,New Look tapered leg jogger,New Look,19.77,     When you just want to be comfy      Drawstring waistband      Side pockets      Fitted cuffs      Tapered fit   Cut loosely around the thigh and tapered from the knee to the ankle ,missing,bottoms
99,ASOS DESIGN Tall oversized jogger,ASOS DESIGN,39.58,"     Your casual vibe, sorted  Drawstring waistband  Side pockets  Fitted cuffs  Oversized fit  Designed to look baggy ",missing,bottoms
100,ASOS DESIGN wide leg trousers with clean high waist,ASOS DESIGN,44.98,"     An alternative to your jeans      High-rise waist  Zip-side fastening  Wide leg  Fitted at the top, flowing at the bottom ",missing,bottoms
101,Ann Summers Wetlook leggings in black,Ann Summers,26.99 ,     Put your jeans away for a day  Faux-leather finish      High rise   Just like your standards      Elasticated waistband      Bodycon fit  Holds you close ,missing,bottoms
102,ASOS DESIGN Curve Luxe premium satin high waisted wide leg trousers,ASOS DESIGN,98.95 ,      For your going-out thing    High rise   Side pockets  Zip-back fastening  Wide leg  Regular fit on the waist ,missing,bottoms
103,Bershka mom fit trouser with belt in beige,Bershka,35.96, Add-to-bag potential: considerable  High-rise waist  Belt detail  Functional pockets  Regular fit  Just select your usual size ,missing,bottoms
104,Les Girls Les Boys reflective logo slim track pants in black,Les Girls Les Boys,143.93,"     Your casual vibe, sorted  Stretch waistband  side pockets  Branded detail to leg  Slim fit  A narrow cut from hips to hem ",missing,bottoms
105,ASOS DESIGN Curve lounge velour off shoulder sweat and jogger,Les Girls Les Boys,68.36,missing,missing,bottoms
106,Missguided cigarette trousers in black,Missguided,32.38,     High rise      Just like your standards       Split cuffs      It's all in the details      Skinny fit  Cut very closely to the body  ,missing,bottoms
107,ASOS DESIGN utility jogger in organic cotton,ASOS DESIGN,39.58,      Part of our responsible edit     High rise    Drawstring waistband       Functional pockets      Fitted cuffs      Slim fit  A narrow cut from hips to hem ,missing,bottoms
108,Mauvais cropped tapered trousers with chain and logo in grey,Mauvais,80.96,"      For your everyday thing    Regular rise    Concealed fly        Functional pockets        Cropped length  Chain detail  Slim, tapered fit  Cut closely around the thigh with a narrow shape through the leg ",missing,bottoms
109,ASOS DESIGN Curve chino trousers,ASOS DESIGN,35.98,     Part of our responsible edit  Mid-rise waist  Concealed fly  Functional pockets  Regular fit  Just select your usual size ,missing,bottoms
110,Urban Bliss cord wide leg trousers with self belt detail,Urban Bliss,57.57,"     Buy them now, wear them forever  High rise  Belted waist  Concealed fly  Functional pockets  Wide leg  Fitted at the top, flowing at the bottom ",missing,bottoms
111,Skylar Rose Plus flared trousers in sleek sequin co-ord,Skylar Rose,98.95,"      If it sparkles, we're into it    Sequin design    High rise   Flared shape  Cut with a straight leg that flares at the knee ",missing,bottoms
112,ASOS DESIGN pop slim suit trousers,ASOS DESIGN,57.57 , Worth making plans for  Mid rise  Concealed fly with button fastening  Two functional pockets  Suit-style seaming   Slim fit  For a tailored silhouette ,missing,bottoms
