,title,brand,price,description,colour,category
1570,ASOS DESIGN pretty floral shirred waist peg trouser,ASOS DESIGN,39.58,      Add-to-bag potential:  considerable   Floral print   High rise       Shirred waist   Side pockets  Peg style  Regular fit  Just select your usual size ,missing,bottoms
1571,ASOS DESIGN leggings with contrast binding,ASOS DESIGN,28.79,     A wardrobe staple  High rise  Contrast binding  It's good to be different   Bodycon fit   Holds you close  ,missing,bottoms
1572,ASOS DESIGN Tall basic stretch super skinny joggers in organic cotton,ASOS DESIGN,28.79,     Part of our responsible edit  Stretch waistband  Plain design  Skinny fit  Cut very closely from hips to hem ,missing,bottoms
1573,Morgan contrast side stripe tailored trouser with front pleat detail in camel,Morgan,111.54,"     For that thing you have to go to      High rise      Zip fly with hook-and-bar fastening      Side pockets      Contrast stripe to side  Regular fit   No surprises, just a classic cut ",missing,bottoms
1574,ASOS DESIGN Maternity animal print legging,ASOS DESIGN,28.79,      For your daytime thing    Animal print     High rise        Elasticated waistband  Bodycon fit  A tight cut to the body   Designed to fit you from bump to baby  ,missing,bottoms
1575,ASOS DESIGN Tall tracksuit sweat / basic jogger with tie with contrast binding,ASOS DESIGN,57.57,     Part of our responsible edit  Tracksuit set  Crew neck  Contrast stripe to sleeve  Ribbed trims  Jogging bottoms  Functional pockets  Fitted cuffs  Slim leg  Regular fit  Just select your usual size ,missing,bottoms
1576,ASOS DESIGN oversized jogger,asos design,39.58,"     Your casual vibe, sorted       Stretch waistband       Side pockets      Fitted cuffs      Oversized fit  Designed to look baggy ",missing,bottoms
1577,ASOS DESIGN Petite spray on vinyl trouser,ASOS DESIGN,53.97,     Worth making plans for  High-rise waist  Seam detail  Super-skinny fit  An extra-tight cut from hips to hem ,missing,bottoms
1578,Daisy Street straight leg tailored trouser in star print co-ord,Daisy Street,44.96,     Part of a co-ord set  Jacket sold separately   Star print  High rise  Belt loops  Concealed fly with hook and bar fastening  Side pockets  Straight leg  Regular fit  Just select your usual size ,missing,bottoms
1579,ASOS DESIGN Tall co-ord cable jogger,ASOS DESIGN,50.37,     Part of a co-ord set  Jumper sold separately   Stretch waistband  Cable-knit design  Fitted cuffs  Regular fit  Just select your usual size ,missing,bottoms
1580,ASOS DESIGN Petite cable co-ord in Beige,ASOS DESIGN,100.74,missing,missing,bottoms
1581,ASOS 4505 ski base layer seamless legging in neon,ASOS 4505,32.38,      Living that Alpine life    Seamless construction    High rise       Elasticated waistband  Small logo patch       Super-skinny fit   An extra-tight cut from hips to hem ,missing,bottoms
1582,Topshop Maternity wide leg crop trousers in black,Topshop,39.58,     For your daytime thing  High rise  Stretch waist  Cropped length  Wide leg      Designed to fit through all stages of pregnancy ,missing,bottoms
1583,ASOS DESIGN clean silky cargo pant,ASOS DESIGN,50.37,      Easily dressed up or down    High-rise waist   Drawstring fastening  Stretch back   Drawcord cuff    Regular fit   Just select your usual size ,missing,bottoms
1584,COLLUSION nylon bellow pocket jogger,COLLUSION,44.98,      Put the jeans away for a day    High rise    Adjustable waist      Functioning pockets  Relaxed fit  Think baggy and casual ,missing,bottoms
1585,ASOS DESIGN Petite tapered leather look trousers,ASOS DESIGN,53.97,"     Put the jeans away for a day  High rise  Stretch waist  Side pockets  Regular, tapered fit  A standard cut around the thigh with a slim shape through the leg ",missing,bottoms
1586,Nike Training Colourblock Leggings In Teal And Navy,Nike,62.97,     Working out just got techy  Colour-block design  Mid rise      Elasticated waistband  Nike Swoosh logo  Cropped length      Form-fitting design ,missing,bottoms
1587,ASOS DESIGN lace up side vinyl skinny trouser,ASOS DESIGN,50.37 ,      Worth making plans for    High rise  Stretch waist  Lace-up sides   Skinny fit  Cut very closely from hips to hem ,missing,bottoms
1588,Boohoo exclusive plisse wide leg culottes in grey,boohoo,39.58,"     Worth making plans for  High rise  Stretch waistband  Cropped length  Wide leg  Fitted at the top, flowing at the bottom ",missing,bottoms
1589,ASOS DESIGN Maternity Tall over the bump high waisted leggings in black,ASOS DESIGN,14.39, Basic but essential   High-rise waist  Elasticated waistband  Over-the-bump design   Close-cut bodycon fit  Designed to fit you from bump to baby ,missing,bottoms
1590,ASOS DESIGN fluted hem culottes in botanical print,ASOS DESIGN,53.97,"     For that thing you have to go to      Botanical print  High rise      Concealed fly with hook-and-bar fastening      Cropped length  Wide leg  Fitted at the top, flowing at the bottom ",missing,bottoms
1591,Fashion Union tailored trouser in teal velvet,Fashion Union,62.97,     They've already got your attention  High rise  Concealed fly  Side pockets  Flared shape  Cut with a straight leg that flares at the knee ,missing,bottoms
1592,ASOS DESIGN Maternity slim leg combat trousers in khaki with under the bump waistband,ASOS DESIGN,50.37,     Put the jeans away for a day      Low-rise waist      Side pockets      Rolled cuffs      Slim fit  A narrow cut that sits close to the body      Designed to fit through all stages of pregnancy ,missing,bottoms
1593,adidas Originals adicolor locked up logo leggings in red,adidas,44.98,"      Your casual vibe, sorted    High-rise waist       Elasticated waistband  adidas Trefoil and 3-Stripe logo   Bodycon fit  A tight cut to the body ",missing,bottoms
1594,ASOS 4505 Tall ski super skinny trouser with stirrup in camo,ASOS 4505,107.95,     Living that Alpine life      High-rise waist      Zip-side fastening   Belt loops      Stirrup cuffs  Super-skinny fit  An extra-tight cut from hips to hem ,missing,bottoms
1595,Reebok Training Plus mesh leggings in black,Reebok,68.37,      Witness the fitness       High rise      Just like your standards      Elasticated waistband      Mesh inserts for breathability       Flat seams to reduce friction       Form-fitting cut ,missing,bottoms
1596,Bershka belted high waist trouser in grey check,Bershka,41.36,"      Add them to your everyday line-up    Check design   High rise   Paper-bag style  Belted waist  Ring-buckle detail  Concealed fly   Slim, tapered fit  Cut closely around the thigh with a narrow shape through the leg ",missing,bottoms
1597,ASOS DESIGN high waist cigarette trousers with belt,ASOS DESIGN,50.37,      Add-to-bag potential: considerable    High rise   Belted waist  Concealed fly  Side pockets  Regular fit  Just select your usual size ,missing,bottoms
1598,Mango tie waist trousers in khaki,Mango,64.75,     Add-to-bag potential: considerable  Drawstring waistband  Side pockets  Cropped cut  Regular fit  Just select your usual size ,missing,bottoms
1599,Saint Genies Plus tailored wide leg trouser in hot pink,Saint Genies,53.97," Part of a co-ord set  Blazer sold separately  High rise  Hook-and-bar fastening  Concealed fly  Wide leg  Fitted at the top, flowing at the bottom ",missing,bottoms
1600,PrettyLittleThing suedette leggings with corset lace up detail in black,PrettyLittleThing,44.98,     Easily dressed up or down      High rise  Lace-up front  Bodycon fit  A tight cut to the body ,missing,bottoms
1601,Mauvais tapered trousers in green and black check,Mauvais,80.96,"      For when you mean business    Check pattern    Mid rise    Belt loops     Concealed fly with button fastening    Side pockets  Regular, tapered fit  A standard cut around the thigh with a narrow shape through the leg ",missing,bottoms
1602,South Beach zebra print panelled leggings,South Beach,35.98,"     Activewear, but make it fashion      High rise      Elasticated waistband      Contrast printed panels  Mesh inserts for added breathability  Close-cut bodycon fit  Exclusive to ASOS ",missing,bottoms
1603,ASOS DESIGN Luxe pu ruched super high waisted trousers,ASOS DESIGN,116.94 ,"     May induce confidence       Super-high-rise waist      Ruched design       Zip-back fastening  Skinny fit  Tight cut, regular on the waist ",missing,bottoms
1604,Katchme satin cargo pant in tan,ASOS DESIGN,64.75,     An alternative to your jeans      Drawstring waist  Cargo-style pockets  Stretch cuffs  Slim fit  A narrow cut from hips to hem  Exclusive to ASOS ,missing,bottoms
1605,ASOS DESIGN clean high waist wide leg trouser with pocket detail,ASOS DESIGN,68.37,"     They’re everything you’ve been scrolling for  High-rise waist  Concealed fly  Side pockets  Wide leg  Fitted at the top, flowing at the bottom ",missing,bottoms
1606,& Other Stories velvet co-ord straight leg trouser in black,& Other Stories,80.96,      Part of a co-ord set    Top sold separately     High rise       Straight leg  Regular fit  True to size ,missing,bottoms
1607,ASOS DESIGN spray on vinyl trousers,ASOS DESIGN,53.97,     Cue the party playlist      High rise      Stretch waistband      Super-skinny fit  Cut very closely from hips to hem ,missing,bottoms
1608,ASOS DESIGN Petite utility jogger,ASOS DESIGN,39.58,      Part of our responsible edit    Drawstring waistband        Cargo pockets   Regular fit  True to size ,missing,bottoms
1609,Another Reason relaxed t-shirt & trousers in plisse co-ord,ASOS DESIGN,89.96,missing,missing,bottoms
1610,ASOS DESIGN Tall structured scuba ruffle flare,ASOS DESIGN,71.96 ,"     Dramatic entrance, sorted  High rise  Oversized ruffle  Slim fit  Regular on the waist, flared at the knee ",missing,bottoms
1611,ASOS 4505 body map seamless legging,ASOS 4505,50.37,"     Buy, rep, repeat  Stretch waistband  All-over print  Bodycon fit  A tight cut to the body ",missing,bottoms
1612,ASOS DESIGN Curve knitted co-ord in Stone,ASOS 4505,107.94,missing,missing,bottoms
1613,Glamorous Curve relaxed trousers in plisse,Glamorous,46.78,     Add-to-bag potential: considerable  Stretch waistband  Relaxed fit  Think baggy and casual ,missing,bottoms
1614,ASOS DESIGN quilted jogger in black with drawcord,ASOS DESIGN,57.57,     An alternative to your jeans  Drawstring waistband  Concealed fly  Functional pockets  Turn-up hem  Straight leg  Regular fit  Just select your usual size ,missing,bottoms
1615,ASOS DESIGN leggings with deep waistband,ASOS DESIGN,17.99,      Part of our responsible edit    Very high rise       Elasticated waistband      Bodycon fit  A tight cut to the body ,missing,bottoms
1616,ASOS DESIGN fold over waist super soft jogger,ASOS DESIGN,32.38,      Part of our responsible edit   Stretch waistband  Fold-over design      Side pockets  Fitted cuffs  Regular fit  Just select your usual size ,missing,bottoms
1617,ASOS DESIGN metallic utility suit,ASOS DESIGN,143.93,missing,missing,bottoms
1618,Nike Club black skinny joggers,Nike,59.37,"     Your casual vibe, sorted      Drawstring waistband   Nike Swoosh logo      Side pockets      Fitted cuffs  Skinny fit  Cut closely from hips to hem ",missing,bottoms
1619,Only wide leg cord trouser in navy,Only,62.97,"     Add them to your everyday line-up      High-rise waist      Concealed fly       Side pockets  Wide leg  Fitted at the top, flowing at the bottom ",missing,bottoms
1620,ASOS DESIGN Maternity tailored tie waist tapered ankle grazer trousers,ASOS DESIGN,44.98,"     Give your jeans a day off  Under-the-bump waistband  Tie waist  Regular, tapered fit  A standard cut around the thigh with a narrow shape through the leg      Designed to fit you from bump to baby  ",missing,bottoms
1621,HIIT colour block leggings in navy,HIIT,44.98," Activewear, but make it fashion  High-cut waistband for added comfort and support  Colour-block design  Bodycon fit  A tight cut to the body ",missing,bottoms
1622,Vero Moda Tall cord straight leg trousers in tan,Vero Moda ,68.37,     Add-to-bag potential: considerable  Mid-rise waist  Concealed fly  Functional pockets  Straight leg  Regular fit  Just select your usual size ,missing,bottoms
1623,ASOS 4505 Petite colour block legging,ASOS 4505,39.58,"     Activewear, but make it fashion   Colour-block design   High rise  Stretchy waistband  ASOS 4505 logo print to reverse  Flat seams feel smooth against your skin  Cropped leg  Bodycon fit  A tight cut to the body ",missing,bottoms
1624,Parallel Lines soft tailored wide leg trouser with pleat detail in caramel,Parallel Lines,62.97,"     Business, meet pleasure  High rise  Zip fly with hook-and-bar closure  Side pockets  Wide leg with pleat detailing  Regular fit  Just select your usual size  ",missing,bottoms
1625,Billabong Terry ski pant in charcoal,Billabong,242.88,"     Living that Alpine life       Internal waist adjusters       Hand-warmer pockets       Jacket-to-pant attachment system      Concealed fly       Zipped inner thigh vents with mesh lining for breathability      Hook-fastened boot gaiters      Zipped cuffs  Skinny fit  Tight cut, regular on the waist ",missing,bottoms
1626,ASOS DESIGN Maternity under the bump basic jogger with tie,ASOS DESIGN,32.38,"     Your casual vibe, sorted  Drawstring waist  Side pockets  Fitted cuffs  Regular fit  Just select your usual size      Designed to fit you from bump to baby ",missing,bottoms
1627,Fashion Union Tall velvet trouser coord in allover diamante,Fashion Union,62.97,     Part of a co-ord set  Top sold separately  Mid-rise waist  Concealed fly  All-over embellishment  Contrast trim   Regular fit   Just select your usual size ,missing,bottoms
1628,ASOS DESIGN pop waisted suit in black,Fashion Union,151.12,missing,missing,bottoms
1629,ASOS DESIGN oversized jogger in tie dye print with hot fix,ASOS DESIGN,50.37,"     Your casual vibe, sorted  Tie-dye print  Stretch waistband  Gem detail to leg  Fitted cuffs  Oversized fit  Designed to look baggy ",missing,bottoms
1630,ASOS DESIGN Petite basic jogger with tie,ASOS DESIGN,32.38,      Part of our responsible edit    Drawstring waistband       Side pockets      Fitted cuffs      Regular fit  True to size ,missing,bottoms
1631,Missguided sweat co-ord in blue,ASOS DESIGN,61.17,missing,missing,bottoms
1632,Nike Air Running leggings in black,Nike,80.96,"      Activewear, but make it fashion   Mid rise  Stretch waistband  Nike Swoosh logo  Mesh panels for breathability  Zip pocket to reverse  Form-fitting design ",missing,bottoms
1633,Nike Training crop leggings in colourblock,Nike,77.36, For exercise or everyday wear  High waist  Stretch waistband  Colour-block design  Close-cut bodycon fit ,missing,bottoms
1634,Mauvais co-ord in grey and black check,Nike,143.93,missing,missing,bottoms
1635,Miss Selfridge utility trousers with belt in khaki,Miss Selfridge,62.97,      For your daytime thing    High rise   Concealed fly   Belted waist      Functional pockets  Regular fit  Just select your usual size ,missing,bottoms
1636,ASOS DESIGN Curve cargo suit trousers in orange,ASOS DESIGN,71.96,"     They've already got your attention      High-rise waist      Concealed fly      Cargo-style pockets  Regular, tapered fit  A standard cut around the thigh with a narrow shape through the leg ",missing,bottoms
1637,Stradivarius coated trouser in camel,Stradivarius,35.96,"      Coming soon to your Saved Items    High-rise waist       Concealed fly       Functional pockets  Skinny fit  Tight cut, regular on the waist ",missing,bottoms
1638,Vila textured trousers in snake print,Vila,71.96,     Worth making plans for  Elasticated waistband  Snake print  Zipped cuffs  Bodycon fit  A tight cut to the body ,missing,bottoms
1639,ASOS DESIGN Tall button detail high waist 80s tapered trousers,ASOS DESIGN,62.97,"     Surprise your monochrome palette with these      High-rise waist  Concealed fly  Side pockets  Regular, tapered fit  A standard cut around the thigh with a narrow shape through the leg ",missing,bottoms
1640,River Island faux leather skinny trousers in black,River Island,64.77,      Worth making plans for     High-rise waist    Belt loops        Concealed fly with button fastening       Five pockets  Skinny fit  Cut very closely from hips to hem ,missing,bottoms
1641,COLLUSION wire print legging,COLLUSION,26.99,     They've already got your attention  Wire print      High rise      Elasticated waistband  Bodycon fit  A tight cut to the body ,missing,bottoms
1642,Wild Honey Plus wide leg trousers in faux leather,Wild Honey,61.17,     An alternative to your denim  High-rise waist  Belt loops  Zip fly  Side pockets and back pockets  Wide leg  Regular fit  Just select your usual size  ,missing,bottoms
1643,Monki co-ord cuffed utility cargo trousers in dark grey,Monki,62.97,     Part of a co-ord set  Jacket sold separately       High rise  Drawstring waist      Side pockets      Fitted cuffs  Regular fit  Just select your usual size ,missing,bottoms
1644,Hollister logo jogger,Hollister,62.97,     Throw on and go      Drawstring waistband   Branded taping       Side pockets      Relaxed fit  Think baggy and casual  ,missing,bottoms
1645,ASOS DESIGN Petite inverted pleat clean balloon leg trouser with turn up,ASOS DESIGN,57.57,      Part of our responsible edit    High rise    Concealed fly    Inverted pleat  Wide leg  Regular fit on the waist ,missing,bottoms
1646,Club L London sparkle paperbag waist wide leg trouser in white,Club L,80.96,"     For that thing you have to go to      Embellished fabric  High rise      Belted waist  Zip-back fastening  Wide leg  Fitted at the top, flowing at the bottom ",missing,bottoms
1647,ASOS DESIGN pop suit in pop yellow,Club L,151.12,missing,missing,bottoms
1648,Vivienne Westwood Anglomania logo badge joggers co-ord,Vivienne Westwood,305.85, Part of a co-ord set  Sweatshirt sold separately      Drawstring waistband   Side pockets  Fitted cuffs  Relaxed fit  Think baggy and casual ,missing,bottoms
1649,PrettyLittleThing wide leg trousers co-ord in ivory,PrettyLittleThing,39.58,"      Add-to-bag potential: considerable    High rise   Wide leg  Fitted at the top, flowing at the bottom ",missing,bottoms
1650,Missguided utility joggers with pocket detail in nude,Missguided,44.98,"     Your casual vibe, sorted  Elasticated waist  Cargo-style pocket to leg  Fitted cuffs  Relaxed fit  For a slouchy silhouette ",missing,bottoms
1651,Hosbjerg straight leg trousers in neon dalmatian spot co-ord,Missguided,242.88,     They've already got your attention       High rise  Elasticated waistband   Dalmatian design       Straight leg  Regular fit  Just select your usual size ,missing,bottoms
1652,Spanx faux leather high waist sculpting leggings,Spanx,160.12,     Easily dressed up or down       High rise  Wide-cut waistband      Bodycon fit  Holds you close  ,missing,bottoms
1653,Superdry SKI Carbon baselayer legging,Superdry,62.95,     Living that Alpine life   Branded stretch waistband  Flat-lock seams      Close-cut bodycon fit ,missing,bottoms
1654,Stradivarius chain detail tailored trouser in grey,Stradivarius,35.96,      Put the jeans away for a day    High-rise waist       Belt loops  Concealed fly with button fastening      Side and back pockets  Chain detail      Regular fit  Just select your usual size ,missing,bottoms
1655,The North Face Presena ski pant in black,The North Face,287.86,     Living that Alpine life    Adjustable waist tabs   Belt loops  Zip pockets  Leg vents  Snow gaiter  Kick patches  Reinforced edge guard      Regular fit  True to size ,missing,bottoms
1656,Glamorous cami top & wide leg trousers in fine knit co-ord,The North Face,75.56,missing,missing,bottoms
1657,Protest Natasha salopette in red,Protest,233.88,"     Take it from shredding to après-ski  Waterproof up to 10,000mm   Adjustable straps        Scoop neck  Zip fastening to front  Critically taped seams for extra protection from moisture       Double-layer design for added warmth and durability       Articulated knees for improved mobility and flexibility       Zipped cuffs   Regular fit  Just select your usual size ",missing,bottoms
1658,Wolf & Whistle leopard print leggings with side panel in black,Wolf & Whistle,62.97 ,      Part of our responsible edit    High-rise waist   Leopard print      Elasticated waistband  Bodycon fit  A tight cut to the body  Exclusive to ASOS ,missing,bottoms
1659,Parallel Lines suedette slim trouser with zip front detail in grey,Parallel Lines,68.37,     An alternative to your denim  High rise  Elasticated waistband  Zip front  Faux back pockets  Zipped hem opening  Skinny fit   Cut closely from hips to hem ,missing,bottoms
1660,Rokoko leggings with wrap waist co-ord,Rokoko,35.98,     Part of a co-ord set  Top sold separately  Mid-rise waist  Cut-out design      Close-cut bodycon fit  Exclusive to ASOS ,missing,bottoms
1661,COLLUSION nylon swirl print trouser,COLLUSION,53.97,      Part of our responsible edit    High rise   Drawstring waist  Spiral design  Contrast taping  Fitted cuffs  Regular fit  Just select your usual size ,missing,bottoms
1662,Daisy Street satin cargo trousers,Daisy Street,50.36,     Put the jeans away for a day  Unlined for a lightweight feel      High-rise waist      Zip fly       Side pockets  Press-stud cargo pockets      Wide-cut leg      Regular fit  Just select your usual size ,missing,bottoms
1663,Mauvais tapered trousers with chain detail in grey and black check,Mauvais,80.96,"     A smarter alternative to your denim  Regular rise  Concealed fly  Chain detail  Check design  Side pockets  Slim, tapered fit  Cut closely around the thigh with a narrow shape through the leg ",missing,bottoms
1664,ASOS 4505 lace up detail legging,ASOS 4505,50.37,     For exercise or everyday wear      High rise      Stretch waistband      Cut-out design  Cropped length  Bodycon fit  A tight cut to the body ,missing,bottoms
1665,ASOS DESIGN Curve legging in marl,ASOS DESIGN,17.99,      Add them to your everyday line-up   Minimal design  High-rise waist  Bodycon fit  A tight cut to the body ,missing,bottoms
1666,ASOS EDITION Petite double breasted jacket & wide leg trouser in green,ASOS DESIGN,305.84,missing,missing,bottoms
1667,Topshop vinyl trousers in black,Topshop,64.77,"      Add an edge to your look     High rise       Zip-side fastening   Cropped length   Super-skinny fit  Extra-tight cut, regular on the waist ",missing,bottoms
1668,My Mum Made It relaxed sweatpants with logo and contrast stitching co-ord,Topshop,80.96,"     Part of a co-ord set  Sweatshirt sold separately  High rise  Elasticated waistband  Side pockets  Exposed seams  Branded label to left leg  Fitted cuffs  Regular, tapered fit  A standard cut around the thigh with a narrow shape through the leg ",missing,bottoms
1669,ASOS DESIGN high waist glam belted trouser,ASOS DESIGN,62.97,"     For that thing you have to go to      High rise      Belted waist   Pleated details    Cropped length   Regular, tapered fit  A standard cut around the thigh with a narrow shape through the leg ",missing,bottoms
1670,Volcom Stone fleece logo tracksuit bottoms in black,ASOS DESIGN,89.96,     Add-to-bag potential: considerable  Drawstring waist  Volcom slogan to reverse  Fitted cuff  Regular fit  Just select your usual size ,missing,bottoms
1671,ASOS DESIGN Maternity Petite tracksuit sweat / basic under the bump jogger with tie with contrast binding,ASOS DESIGN,57.57,     Part of our responsible edit   Crew neck  Contrast binding  Jogger bottoms  Drawstring waistband  Side pockets   Fitted cuffs  Relaxed fit  For a slouchy silhouette   Designed to fit through all stages of pregnancy ,missing,bottoms
1672,COLLUSION Petite skinny jogger in grey,COLLUSION,21.59, Do sweat it  Drawstring waistband  Side pockets  Fitted cuffs  Regular fit  Just select your usual size ,missing,bottoms
1673,ASOS DESIGN petite spray on leather look trouser,ASOS DESIGN,44.98, Worth making plans for  High rise  Seaming to legs  Super-skinny fit  An extra-tight cut from hips to hem ,missing,bottoms
1674,ASOS DESIGN Tall mix & match lounge super soft brushed jogger,ASOS DESIGN,39.58,"     For when plans get cancelled, but you weren't going anyway      High rise      Drawstring waistband      Relaxed fit      Think baggy and casual ",missing,bottoms
1675,Missguided vinyl high waisted trousers in dusky rose,Missguided,53.97,      They’re everything you’ve been scrolling for    High-rise waist       Concealed fly       Functional pockets       Skinny fit   Cut very closely from hips to hem ,missing,bottoms
1676,adidas Alphaskin Leggings In Black,adidas,62.97," Sporty with added spice   Built-in UV 50+ protection  Anti-odour properties   Keeps your gear fresher for longer  Elasticated waistband  adidas branding   Flatlock seams help reduce chafing   Clever, right?  Close-cut compression fit  Designed for greater movement and support ",missing,bottoms
1677,Obey slim fit carpenter pant,Obey,125.94,     Put the jeans away for a day      High-rise waist  Belt loops  Concealed fly  Side and back pockets  Small Obey logo tab  Slim fit  A narrow cut from hips to hem ,missing,bottoms
1678,Urban Bliss Maternity utility trousers,Obey,62.97," <a href=""https://www.asos.com/women/maternity/trousers-leggings/cat/?cid=17127""><strong>Maternity trousers</strong></a> by Urban Bliss<br><ul>  For your everyday thing    Elasticated waist    Side pockets        Cargo-style pockets   Fitted cuffs  Regular fit  True to size  Exclusive to ASOS      Designed to fit through all stages of pregnancy </ul> ",missing,bottoms
1679,Pieces faux leather trousers with paperbag waist,PIECES,80.96,      Worth making plans for     High rise     Paperbag waist    Belted design        Concealed fly      Side pockets  Regular fit  Just select your usual size  ,missing,bottoms
1680,ASOS DESIGN plisse culotte trousers,ASOS DESIGN,39.58,     A go-to wardrobe addition      Stretch waistband      Textured finish      It's all in the details      Regular fit - true to size<br> ,missing,bottoms
