,url,brand,title,price,description,colour,material
248,https://www.aforarcade.com/product/women/clothing/outerwear/arcade-x-teeteeheehee-pocket-cardigan-in-marmalade,A for Arcade,ARCADE X TEETEEHEEHEE POCKET CARDIGAN IN MARMALADE,$39.00,"For Arcade's 7th Anniversary, we have collaborated with five of our #ArcadeInsiders to design five capsule collections, capturing the essence of what makes each of them distinctly individual yet unmistakably Arcade.<br><br>An artistic individual with a passion for craft, Teresa — who goes by the moniker teeteeheehee — has a quirky, vintage-inspired style that largely features a mixture of upbeat colours. Her love for colour has been strongly imprinted on her collection with Arcade, which heavily features a series of motifs and embroidered details designed by her.<br><br>",MARMALADE,Made of Cotton blend
249,https://www.aforarcade.com/product/women/clothing/outerwear/arcade-x-teeteeheehee-pocket-cardigan-in-dusk-blue,A for Arcade,ARCADE X TEETEEHEEHEE POCKET CARDIGAN IN DUSK BLUE,$39.00,"For Arcade's 7th Anniversary, we have collaborated with five of our #ArcadeInsiders to design five capsule collections, capturing the essence of what makes each of them distinctly individual yet unmistakably Arcade.<br><br>An artistic individual with a passion for craft, Teresa — who goes by the moniker teeteeheehee — has a quirky, vintage-inspired style that largely features a mixture of upbeat colours. Her love for colour has been strongly imprinted on her collection with Arcade, which heavily features a series of motifs and embroidered details designed by her.<br><br>",DUSK BLUE,Made of Cotton blend
250,https://www.aforarcade.com/product/women/clothing/outerwear/arcade-x-teeteeheehee-pocket-cardigan-in-forest,A for Arcade,ARCADE X TEETEEHEEHEE POCKET CARDIGAN IN FOREST,$39.00,"For Arcade's 7th Anniversary, we have collaborated with five of our #ArcadeInsiders to design five capsule collections, capturing the essence of what makes each of them distinctly individual yet unmistakably Arcade.<br><br>An artistic individual with a passion for craft, Teresa — who goes by the moniker teeteeheehee — has a quirky, vintage-inspired style that largely features a mixture of upbeat colours. Her love for colour has been strongly imprinted on her collection with Arcade, which heavily features a series of motifs and embroidered details designed by her.<br><br>",FOREST,Made of Cotton blend
251,https://www.aforarcade.com/product/women/clothing/tops/arcade-x-elkantlers-ribbed-top-in-white,A for Arcade,ARCADE X ELKANTLERS RIBBED TOP IN WHITE,$34.00,"For Arcade's 7th Anniversary, we have collaborated with five of our #ArcadeInsiders to design five capsule collections, capturing the essence of what makes each of them distinctly individual yet unmistakably Arcade.<br><br>A minimalist at heart who prefers a monochromatic palette, Olivia (@elkantlers) is also big on the little details. Her collection with Arcade focuses on elevated everyday styles that each have their own unique flair, and can all come together to create a polished wardrobe that hits the spot.<br><br>",WHITE,Made of Cotton blend
252,https://www.aforarcade.com/product/women/clothing/tops/arcade-x-elkantlers-ribbed-top-in-black,A for Arcade,ARCADE X ELKANTLERS RIBBED TOP IN BLACK,$34.00,"For Arcade's 7th Anniversary, we have collaborated with five of our #ArcadeInsiders to design five capsule collections, capturing the essence of what makes each of them distinctly individual yet unmistakably Arcade.<br><br>A minimalist at heart who prefers a monochromatic palette, Olivia (@elkantlers) is also big on the little details. Her collection with Arcade focuses on elevated everyday styles that each have their own unique flair, and can all come together to create a polished wardrobe that hits the spot.<br><br>",BLACK,Made of Cotton blend
253,https://www.aforarcade.com/product/women/clothing/dresses/arcade-x-elkantlers-wrap-dress-in-pink,A for Arcade,ARCADE X ELKANTLERS WRAP DRESS IN PINK,$45.00,"For Arcade's 7th Anniversary, we have collaborated with five of our #ArcadeInsiders to design five capsule collections, capturing the essence of what makes each of them distinctly individual yet unmistakably Arcade.<br><br>A minimalist at heart who prefers a monochromatic palette, Olivia (@elkantlers) is also big on the little details. Her collection with Arcade focuses on elevated everyday styles that each have their own unique flair, and can all come together to create a polished wardrobe that hits the spot.<br><br>",PINK,Made of Polyester blend
254,https://www.aforarcade.com/product/women/clothing/dresses/arcade-x-elkantlers-wrap-dress-in-grey,A for Arcade,ARCADE X ELKANTLERS WRAP DRESS IN GREY,$45.00,"For Arcade's 7th Anniversary, we have collaborated with five of our #ArcadeInsiders to design five capsule collections, capturing the essence of what makes each of them distinctly individual yet unmistakably Arcade.<br><br>A minimalist at heart who prefers a monochromatic palette, Olivia (@elkantlers) is also big on the little details. Her collection with Arcade focuses on elevated everyday styles that each have their own unique flair, and can all come together to create a polished wardrobe that hits the spot.<br><br>",GREY,Made of Polyester blend
255,https://www.aforarcade.com/product/women/clothing/dresses/arcade-x-elkantlers-wrap-dress-in-black,A for Arcade,ARCADE X ELKANTLERS WRAP DRESS IN BLACK,$45.00,"For Arcade's 7th Anniversary, we have collaborated with five of our #ArcadeInsiders to design five capsule collections, capturing the essence of what makes each of them distinctly individual yet unmistakably Arcade.<br><br>A minimalist at heart who prefers a monochromatic palette, Olivia (@elkantlers) is also big on the little details. Her collection with Arcade focuses on elevated everyday styles that each have their own unique flair, and can all come together to create a polished wardrobe that hits the spot.<br><br>",BLACK,Made of Polyester blend
256,https://www.aforarcade.com/product/women/clothing/tops/arcade-x-chloeandchoo-square-neck-top-in-heather-grey,A for Arcade,ARCADE X CHLOEANDCHOO SQUARE NECK TOP IN HEATHER GREY,$34.00,"For Arcade's 7th Anniversary, we have collaborated with five of our #ArcadeInsiders to design five capsule collections, capturing the essence of what makes each of them distinctly individual yet unmistakably Arcade.<br><br>An adventurous spirit with a “go big or go home” attitude, Chloe (@chloeandchoo) is always seen in daring styles that are largely experimental and expressive of her big personality. Her collection with Arcade features eye-catching pieces that are outright bold, and are definite head-turners for the spontaneous souls.<br><br>",HEATHER GREY,Made of Cotton blend
257,https://www.aforarcade.com/product/women/clothing/tops/arcade-x-chloeandchoo-square-neck-top-in-black,A for Arcade,ARCADE X CHLOEANDCHOO SQUARE NECK TOP IN BLACK,$34.00,"For Arcade's 7th Anniversary, we have collaborated with five of our #ArcadeInsiders to design five capsule collections, capturing the essence of what makes each of them distinctly individual yet unmistakably Arcade.<br><br>An adventurous spirit with a “go big or go home” attitude, Chloe (@chloeandchoo) is always seen in daring styles that are largely experimental and expressive of her big personality. Her collection with Arcade features eye-catching pieces that are outright bold, and are definite head-turners for the spontaneous souls.",BLACK,Made of Cotton blend
258,https://www.aforarcade.com/product/women/clothing/pants/arcade-x-chloeandchoo-striped-pants-in-dark-navy,A for Arcade,ARCADE X CHLOEANDCHOO STRIPED PANTS IN DARK NAVY,$39.00,"For Arcade's 7th Anniversary, we have collaborated with five of our #ArcadeInsiders to design five capsule collections, capturing the essence of what makes each of them distinctly individual yet unmistakably Arcade.<br><br>An adventurous spirit with a “go big or go home” attitude, Chloe (@chloeandchoo) is always seen in daring styles that are largely experimental and expressive of her big personality. Her collection with Arcade features eye-catching pieces that are outright bold, and are definite head-turners for the spontaneous souls.&nbsp;<br><br>",DARK NAVY,Made of Cotton blend
259,https://www.aforarcade.com/product/women/clothing/pants/arcade-x-chloeandchoo-striped-pants-in-cider,A for Arcade,ARCADE X CHLOEANDCHOO STRIPED PANTS IN CIDER,$39.00,"For Arcade's 7th Anniversary, we have collaborated with five of our #ArcadeInsiders to design five capsule collections, capturing the essence of what makes each of them distinctly individual yet unmistakably Arcade.<br><br>An adventurous spirit with a “go big or go home” attitude, Chloe (@chloeandchoo) is always seen in daring styles that are largely experimental and expressive of her big personality. Her collection with Arcade features eye-catching pieces that are outright bold, and are definite head-turners for the spontaneous souls.<br><br>",CIDER,Made of Cotton blend
260,https://www.aforarcade.com/product/women/clothing/pants/arcade-x-chloeandchoo-striped-pants-in-black,A for Arcade,ARCADE X CHLOEANDCHOO STRIPED PANTS IN BLACK,$39.00,"For Arcade's 7th Anniversary, we have collaborated with five of our #ArcadeInsiders to design five capsule collections, capturing the essence of what makes each of them distinctly individual yet unmistakably Arcade.<br><br>An adventurous spirit with a “go big or go home” attitude, Chloe (@chloeandchoo) is always seen in daring styles that are largely experimental and expressive of her big personality. Her collection with Arcade features eye-catching pieces that are outright bold, and are definite head-turners for the spontaneous souls.<br><br>",BLACK,Made of Polyester blend
261,https://www.aforarcade.com/product/women/clothing/dresses/peyton-midi-shirt-dress-in-pine,A for Arcade,PEYTON MIDI SHIRT DRESS IN PINE,$38.00,"Stand out in the subtlest ways with <em>Peyton</em>, a patch pocket dress that features contrast stitching on its camp collar and all four pockets. Both stylish and eye-catching, this midi dress is beautiful yet underrated, and can be matched with casual shoes for that cool weekend look. Unlined. Functional buttons in front. Elastic waistband. Comes with matching sash.",PINE,Made of Cotton blend
262,https://www.aforarcade.com/product/women/clothing/dresses/peyton-midi-shirt-dress-in-navy,A for Arcade,PEYTON MIDI SHIRT DRESS IN NAVY,$38.00,"Stand out in the subtlest ways with <em>Peyton</em>, a patch pocket dress that features contrast stitching on its camp collar and all four pockets. Both stylish and eye-catching, this midi dress is beautiful yet underrated, and can be matched with casual shoes for that cool weekend look. Unlined. Functional buttons in front. Elastic waistband. Comes with matching sash.",NAVY,Made of Cotton blend
263,https://www.aforarcade.com/product/women/clothing/dresses/peyton-midi-shirt-dress-in-dusk-blue,A for Arcade,PEYTON MIDI SHIRT DRESS IN DUSK BLUE,$38.00,"Stand out in the subtlest ways with <em>Peyton</em>, a patch pocket dress that features contrast stitching on its camp collar and all four pockets. Both stylish and eye-catching, this midi dress is beautiful yet underrated, and can be matched with casual shoes for that cool weekend look. Unlined. Functional buttons in front. Elastic waistband. Comes with matching sash.",DUSK BLUE,Made of Cotton blend
264,https://www.aforarcade.com/product/women/clothing/dresses-women/clothing/one-piece/elijah-drop-hem-romper-dress-in-white,A for Arcade,ELIJAH DROP HEM ROMPER DRESS IN WHITE,$37.00, ,WHITE,Made of Cotton blend
265,https://www.aforarcade.com/product/women/clothing/dresses-women/clothing/one-piece/elijah-drop-hem-romper-dress-in-navy,A for Arcade,ELIJAH DROP HEM ROMPER DRESS IN NAVY,$37.00, ,NAVY,Made of Cotton blend
266,https://www.aforarcade.com/product/women/clothing/tops/vanecia-polkadot-flutter-top-in-black,A for Arcade,VANECIA POLKADOT FLUTTER TOP IN BLACK,$34.00,"Cropped and cute, <em>Vanecia</em> features frills around its straps and hem, creating a beautiful visual effect. Suitable for both daytime dates and nighttime events, this funky boho-inspired number can be paired with casual linen shorts or a pair of palazzo pants. Unlined. Side zip. Smock back. Adjustable strap length.",BLACK,Made of Cotton blend 
267,https://www.aforarcade.com/product/women/clothing/tops/vanecia-gingham-flutter-top-in-cocoa,A for Arcade,VANECIA GINGHAM FLUTTER TOP IN COCOA,$34.00,"Cropped and cute, <em>Vanecia</em> features frills around its straps and hem, creating a beautiful visual effect. Suitable for both daytime dates and nighttime events, this funky boho-inspired number can be paired with casual linen shorts or a pair of palazzo pants. Unlined. Side zip. Smock back. Adjustable strap length.",COCOA,Made of Cotton blend 
268,https://www.aforarcade.com/product/women/clothing/tops/vanecia-gingham-flutter-top-in-navy,A for Arcade,VANECIA GINGHAM FLUTTER TOP IN NAVY,$34.00,"Cropped and cute, <em>Vanecia</em> features frills around its straps and hem, creating a beautiful visual effect. Suitable for both daytime dates and nighttime events, this funky boho-inspired number can be paired with casual linen shorts or a pair of palazzo pants. Unlined. Side zip. Smock back. Adjustable strap length.",NAVY,Made of Cotton blend 
269,https://www.aforarcade.com/product/women/clothing/pants/angeles-palazzo-pants-in-hazel,A for Arcade,ANGELES PALAZZO PANTS IN HAZEL,$38.00,"A timeless staple, the high-waisted <em>Angeles</em> pants is a wide-legged palazzo number that is ideal for all occasions! Accompanied with a matching sash, the unique waistband does away with typical belt loops. These pants have an understated elegance which lets you choose whether to wear it fancy, with a structured top&nbsp;and heels, or casual, with a basic tee and sneakers.&nbsp;Unlined. Front Pockets.<br><br>",HAZEL,Made of Polyester blend 
270,https://www.aforarcade.com/product/women/clothing/pants/angeles-palazzo-pants-in-french-pink,A for Arcade,ANGELES PALAZZO PANTS IN FRENCH PINK,$38.00,"A timeless staple, the high-waisted <em>Angeles</em> pants is a wide-legged palazzo number that is ideal for all occasions! Accompanied with a matching sash, the unique waistband does away with typical belt loops. These pants have an understated elegance which lets you choose whether to wear it fancy, with a structured top&nbsp;and heels, or casual, with a basic tee and sneakers.&nbsp;Unlined. Front Pockets.<br><br>",FRENCH PINK,Made of Polyester blend 
271,https://www.aforarcade.com/product/women/clothing/shorts-women/clothing/skirts/ace-girl-plaid-skorts-in-grey,A for Arcade,ACE GIRL PLAID SKORTS IN GREY,$34.00, ,GREY,Made of Polyester blend
272,https://www.aforarcade.com/product/women/clothing/outerwear/bernadette-plaid-pocket-blazer-in-grey,A for Arcade,BERNADETTE PLAID POCKET BLAZER IN GREY,$45.00, ,GREY,Made of Polyester blend
273,https://www.aforarcade.com/product/women/clothing/outerwear/bernadette-plaid-pocket-blazer-in-yellow,A for Arcade,BERNADETTE PLAID POCKET BLAZER IN YELLOW,$45.00, ,YELLOW,Made of Polyester blend
274,https://www.aforarcade.com/product/women/clothing/outerwear/bernadette-plaid-pocket-blazer-in-pink,A for Arcade,BERNADETTE PLAID POCKET BLAZER IN PINK,$42.00, ,PINK,Made of Cotton blend
275,https://www.aforarcade.com/product/women/clothing/tops/naia-linen-top-in-black,A for Arcade,NAIA LINEN TOP IN BLACK,$30.00,"As far as basic tops go, <em>Naia</em> ticks all the right boxes! Comfy, lightweight and stylish, this linen design is also lined — so you don’t have to worry about sheerness at all! Completely versatile, it can be worn with literally any sort of bottoms in your closet! Lined. Elastic band at the back.",BLACK,Made of Cotton blend
276,https://www.aforarcade.com/product/women/clothing/tops/naia-linen-top-in-french-blue,A for Arcade,NAIA LINEN TOP IN FRENCH BLUE,$30.00,"As far as basic tops go, <em>Naia</em> ticks all the right boxes! Comfy, lightweight and stylish, this linen design is also lined — so you don’t have to worry about sheerness at all! Completely versatile, it can be worn with literally any sort of bottoms in your closet! Lined. Elastic band at the back.",FRENCH BLUE,Made of Cotton blend
277,https://www.aforarcade.com/product/women/clothing/tops/naia-linen-top-in-white,A for Arcade,NAIA LINEN TOP IN WHITE,$30.00,"As far as basic tops go, <em>Naia</em> ticks all the right boxes! Comfy, lightweight and stylish, this linen design is also lined — so you don’t have to worry about sheerness at all! Completely versatile, it can be worn with literally any sort of bottoms in your closet! Lined. Elastic band at the back.",WHITE,Made of Cotton blend
278,https://www.aforarcade.com/product/women/clothing/tops/naia-linen-top-in-autumn,A for Arcade,NAIA LINEN TOP IN AUTUMN,$30.00,"As far as basic tops go, <em>Naia</em> ticks all the right boxes! Comfy, lightweight and stylish, this linen design is also lined — so you don’t have to worry about sheerness at all! Completely versatile, it can be worn with literally any sort of bottoms in your closet! Lined. Elastic band at the back.",AUTUMN,Made of Cotton blend
279,https://www.aforarcade.com/product/women/clothing/pants/mika-straight-cut-chinos-in-navy,A for Arcade,MIKA STRAIGHT CUT CHINOS IN NAVY,$35.00,"Three cheers for this perfect pair of basic chinos, an important essential that every wardrobe ought to have! With <em>Mika</em> you never have to worry about running out of styling choices — this easy-to-wear number is so classic that it goes with literally any top you throw on. From sleek, chic to downright casual, no matter the look you’re going for, this pair of pants is a sure win and deserves a place in your ensemble. Unlined. Zip and button closure in front. Front pockets. Slightly stretchy.",NAVY,Made of Cotton blend
280,https://www.aforarcade.com/product/women/clothing/pants/mika-straight-cut-chinos-in-honey,A for Arcade,MIKA STRAIGHT CUT CHINOS IN HONEY,$35.00,"Three cheers for this perfect pair of basic chinos, an important essential that every wardrobe ought to have! With <em>Mika</em> you never have to worry about running out of styling choices — this easy-to-wear number is so classic that it goes with literally any top you throw on. From sleek, chic to downright casual, no matter the look you’re going for, this pair of pants is a sure win and deserves a place in your ensemble. Unlined. Zip and button closure in front. Front pockets. Slightly stretchy.",HONEY,Made of Cotton blend
281,https://www.aforarcade.com/product/women/clothing/pants/mika-straight-cut-chinos-in-vineyard-green,A for Arcade,MIKA STRAIGHT CUT CHINOS IN VINEYARD GREEN,$35.00,"Three cheers for this perfect pair of basic chinos, an important essential that every wardrobe ought to have! With <em>Mika</em> you never have to worry about running out of styling choices — this easy-to-wear number is so classic that it goes with literally any top you throw on. From sleek, chic to downright casual, no matter the look you’re going for, this pair of pants is a sure win and deserves a place in your ensemble. Unlined. Zip and button closure in front. Front pockets. Slightly stretchy.",VINEYARD GREEN,Made of Cotton blend
282,https://www.aforarcade.com/product/women/clothing/dresses/astrid-floral-swing-dress-in-sage,A for Arcade,ASTRID FLORAL SWING DRESS IN SAGE,$37.00,"If you’re the expressive sort with a penchant for experimenting with bold prints, then <em>Astrid</em> definitely belongs in your closet! A swing dress with tiny bows at the end of each sleeve, this lighthearted, youthful number is made for all sorts of cheery occasions. Make a statement in this dress simply by pairing it with basic pumps or sneakers. Lined. Concealed back zip. Side pockets.",SAGE,Made of Polyester blend 
283,https://www.aforarcade.com/product/women/clothing/dresses/astrid-floral-swing-dress-in-black,A for Arcade,ASTRID FLORAL SWING DRESS IN BLACK,$37.00,"If you’re the expressive sort with a penchant for experimenting with bold prints, then <em>Astrid</em> definitely belongs in your closet! A swing dress with tiny bows at the end of each sleeve, this lighthearted, youthful number is made for all sorts of cheery occasions. Make a statement in this dress simply by pairing it with basic pumps or sneakers. Lined. Concealed back zip. Side pockets.",BLACK,Made of Polyester blend 
284,https://www.aforarcade.com/product/women/clothing/skirts/ava-patch-pocket-skirt-in-dusk-blue,A for Arcade,AVA PATCH POCKET SKIRT IN DUSK BLUE,$35.00,"A little chic and slightly feminine, <em>Ava</em> is the type of skirt you can wear any day of the week. Featuring patch pockets in the front this number also has two slits at each side. And because good things come in pairs, it can be paired with a <span style=""text-decoration: underline;""><span style=""color: #000000; text-decoration: underline;""><a href=""/product/women/clothing/tops/mia-frill-top-in-autumn"">frill top</a></span></span> in the exact same shade if you like your outfits to come in a matching set! Lined. Concealed back zip.<br><br>",DUSK BLUE,Made of Polyester blend 
285,https://www.aforarcade.com/product/women/clothing/skirts/ava-patch-pocket-skirt-in-rouge,A for Arcade,AVA PATCH POCKET SKIRT IN ROUGE,$35.00,"A little chic and slightly feminine, <em>Ava</em> is the type of skirt you can wear any day of the week. Featuring patch pockets in the front this number also has two slits at each side. And because good things come in pairs, it can be paired with a <span style=""text-decoration: underline;""><span style=""color: #000000; text-decoration: underline;""><a href=""/product/women/clothing/tops/mia-frill-top-in-autumn"">frill top</a></span></span> in the exact same shade if you like your outfits to come in a matching set! Lined. Concealed back zip.<br><br>",ROUGE,Made of Polyester blend 
286,https://www.aforarcade.com/product/women/clothing/skirts/ava-patch-pocket-skirt-in-sage,A for Arcade,AVA PATCH POCKET SKIRT IN SAGE,$35.00,"A little chic and slightly feminine, <em>Ava</em> is the type of skirt you can wear any day of the week. Featuring patch pockets in the front this number also has two slits at each side. And because good things come in pairs, it can be paired with a <span style=""text-decoration: underline;""><span style=""color: #000000; text-decoration: underline;""><a href=""/product/women/clothing/tops/mia-frill-top-in-autumn"">frill top</a></span></span> in the exact same shade if you like your outfits to come in a matching set! Lined. Concealed back zip.<br><br>",SAGE,Made of Polyester blend 
287,https://www.aforarcade.com/product/women/clothing/tops/mia-frill-top-in-rouge,A for Arcade,MIA FRILL TOP IN ROUGE,$32.00,"It’s cute, it’s frilly and it’s totally the type of top you can wear over and over without it ever getting old. Featuring a frilled neckline, <em>Mia</em> adds an extra element of fun no matter the outfit. And because good things come in pairs, it can also be worn with a <span style=""text-decoration: underline;""><a href=""/product/women/clothing/skirts/ava-patch-pocket-skirt-in-autumn"">patch pocket skirt</a></span> in the exact same shade if you like your outfits in a matching set! Unlined. Concealed back zip.",ROUGE,Made of Polyester blend 
288,https://www.aforarcade.com/product/women/clothing/tops/mia-frill-top-in-sage,A for Arcade,MIA FRILL TOP IN SAGE,$32.00,"It’s cute, it’s frilly and it’s totally the type of top you can wear over and over without it ever getting old. Featuring a frilled neckline, <em>Mia</em> adds an extra element of fun no matter the outfit. And because good things come in pairs, it can also be worn with a <span style=""text-decoration: underline;""><a href=""/product/women/clothing/skirts/ava-patch-pocket-skirt-in-autumn"">patch pocket skirt</a></span> in the exact same shade if you like your outfits in a matching set! Unlined. Concealed back zip.",SAGE,Made of Polyester blend 
289,https://www.aforarcade.com/product/women/clothing/dresses/arya-polkadot-midi-dress-in-honey,A for Arcade,ARYA POLKADOT MIDI DRESS IN HONEY,$39.00,"Nothing better than a comfy flare dress to get you through the weekend! With<em> Arya</em> you’re spoilt for styling choices, and can pair this number with a boho bag and sandals or go street-chic with a pair of sneakers. It can even double as a work dress on casual Fridays. Lined. Side pockets. Functional buttons down the front.<br><br>",HONEY,Made of Cotton blend 
290,https://www.aforarcade.com/product/women/clothing/tops/beth-button-blouse-in-white,A for Arcade,BETH BUTTON BLOUSE IN WHITE,$34.00,"A lightweight top for vintage lovers,<em> Beth</em> exudes old-school vibes while managing to stay modern. Featuring functional buttons down the front, this number can be worn as an off-shoulder piece as well, and looks best with a cute pair of skorts or a simple pair of jeans. Unlined.&nbsp;Elastic bands at the sleeves.",WHITE,Made of Cotton blend 
291,https://www.aforarcade.com/product/women/clothing/shorts-women/clothing/skirts/cameron-pocket-skorts-in-olive,A for Arcade,CAMERON POCKET SKORTS IN OLIVE,$35.00,"Who doesn’t love a fun pair of skorts? Featuring an asymmetrical hem and eye-catching pocket in front, <em>Cameron</em> is for the tomboys who want a visually captivating outfit. Suitable for wear with any type of top, from plain sleeveless tees to loud printed shirts, this number sure ticks both the style and comfort boxes! Partially lined.",OLIVE,Made of Cotton blend
